Candidate,Date,Headline,Site
trump,2016-10-01,Trump and the Intellectuals,New York Times
trump,2016-10-01,The Other Trump,New York Times
trump,2016-10-01,Trump Infrastructure Plan’s Fatal Flaw,New York Times
trump,2016-10-01,Donald Trump’s Pathetic Fraternity,New York Times
trump,2016-10-01,How Could Anyone Vote for Trump?,New York Times
trump,2016-10-01,Donald Trump Opens New Line of Attack on Hillary Clinton: Her Marriage,New York Times
trump,2016-10-01,Report That Donald Trump Did Business in Cuba Ups the Ante in Florida,New York Times
trump,2016-10-01,"After Trump-Clinton, Vice-Presidential Debate Isn’t Exactly ‘the Return of Elvis’",New York Times
trump,2016-10-01,Donald Trump Is Seen as Helping Push Asian-Americans Into Democratic Arms,New York Times
trump,2016-10-01,Girl Talk at Trump Tower,New York Times
trump,2016-10-02,Donald Trump’s Taxes,New York Times
trump,2016-10-02,Trump’s Tax Records,New York Times
trump,2016-10-02,Alicia Machado vs. Donald Trump’s Machismo,New York Times
trump,2016-10-02,How Donald Trump Turned the Tax Code Into a Giant Tax Shelter,New York Times
trump,2016-10-02,Donald Trump Criticizes Hillary Clinton,New York Times
trump,2016-10-02,The Time I Found Donald Trump’s Tax Records in My Mailbox,New York Times
trump,2016-10-02,Donald Trump’s Taxes: What We Know and Don’t Know,New York Times
trump,2016-10-02,‘S.N.L.’ Begins a New Season With Alec Baldwin as Donald Trump,New York Times
trump,2016-10-02,"Donald Trump Tax Records Show He Could Have Avoided Taxes for Nearly Two Decades, The Times Found",New York Times
trump,2016-10-02,Donald Trump and His Allies Struggle to Move Past Tax Revelation,New York Times
trump,2016-10-03,The Trump Possibility,New York Times
trump,2016-10-03,Trump’s Fellow Travelers,New York Times
trump,2016-10-03,Trump’s Tax (Avoidance) Plan,New York Times
trump,2016-10-03,James Stewart on Trump’s Taxes,New York Times
trump,2016-10-03,Trump Defends Tax Payments,New York Times
trump,2016-10-03,Clinton Hits Trump on Taxes,New York Times
trump,2016-10-03,Donald Trump: Terroristic Man-Toddler,New York Times
trump,2016-10-03,Donald Trump Says a Strong Defense Against Cyberattacks Is Essential,New York Times
trump,2016-10-03,State Attorney General Orders Trump Foundation to Cease Raising Money in New York,New York Times
trump,2016-10-03,9 Times Donald Trump Complained About Taxes,New York Times
trump,2016-10-04,Mr. Trump’s Government Bailout,New York Times
trump,2016-10-04,"Trump, Taxes and Citizenship",New York Times
trump,2016-10-04,"Gomez Addams, Donald Trump and the Art of Failing",New York Times
trump,2016-10-04,"The Trump Dialogues, From a Parody Universe",New York Times
trump,2016-10-04,"Better Polling for Clinton, but Trump Is Keeping Core Support",New York Times
trump,2016-10-04,Donald Trump’s Business Decisions in ’80s Nearly Led Him to Ruin,New York Times
trump,2016-10-04,"When It Comes to Tax Avoidance, Donald Trump’s Just a Small Fry",New York Times
trump,2016-10-04,Trump as ‘Role Model’? Kelly Ayotte Says She Misspoke,New York Times
trump,2016-10-04,How a Simple Tax Rule Let Donald Trump Turn a $916 Million Loss Into a Plus,New York Times
trump,2016-10-04,Vice-Presidential Debate: What You Missed,New York Times
trump,2016-10-05,A Trumpism of the Left,New York Times
trump,2016-10-05,Kaine and Pence on Trump’s Taxes,New York Times
trump,2016-10-05,Kaine on Pence’s Support of Trump,New York Times
trump,2016-10-05,Donald Trump’s Slip in Polls Has G.O.P. Worried About Congress,New York Times
trump,2016-10-05,Trump Says Pence Won the Debate,New York Times
trump,2016-10-05,"After Mike Pence’s Debate Showing, Donald Trump Takes Credit",New York Times
trump,2016-10-05,Mike Pence’s Defense Strategy: Dodge and Deflect Donald Trump’s Words,New York Times
trump,2016-10-05,Why Wouldn’t Tiffany Trump Speak for Herself?,New York Times
trump,2016-10-05,Donald Trump as Role Model? G.O.P. Senator ‘Absolutely’ Has Second Thoughts,New York Times
trump,2016-10-05,"In Visceral Ads for Hillary Clinton, Donald Trump Does All the Talking",New York Times
trump,2016-10-06,"Global Trade War, Trump Edition",New York Times
trump,2016-10-06,Trump’s Deals: Hype and Reality,New York Times
trump,2016-10-06,Donald Trump’s Ventures Began With a Lot of Hype. Here’s How They Turned Out.,New York Times
trump,2016-10-06,Mike Pence Disavows Donald Trump’s Earlier Proposal Barring Muslims,New York Times
trump,2016-10-06,Donald Trump Takes Advantage of a Republican Party Pitted Against Itself,New York Times
trump,2016-10-06,Megyn Kelly and Sean Hannity Indulge in Testy Public Clash,New York Times
trump,2016-10-06,"The White House Rule: No Tax Returns, No Job",New York Times
trump,2016-10-06,Who’s Sorry Now? The Country,New York Times
trump,2016-10-06,"Good, Bad and Mad: Andrew Rosenthal on the News",New York Times
trump,2016-10-06,"Debates Past, and Debates Future",New York Times
trump,2016-10-07,Letterman Has No Love for ‘Damaged’ Trump,New York Times
trump,2016-10-07,"Balance, Trump and Lies",New York Times
trump,2016-10-07,Donald Trump Apology Caps Day of Outrage Over Lewd Tape,New York Times
trump,2016-10-07,"A Must-Win Debate for Donald Trump, but Not a Must-Rehearse One",New York Times
trump,2016-10-07,"How This Jobs Report Can Help Clinton, and Trump",New York Times
trump,2016-10-07,My Dad Set the Precedent Donald Trump Is Flouting,New York Times
trump,2016-10-07,When Donald Trump Went to Washington and Got Himself a Tax Break,New York Times
trump,2016-10-07,How Donald Trump Uses the Tax Code in Ways You Can’t,New York Times
trump,2016-10-07,The G.O.P. Ticket; Fox News in Chinatown,New York Times
trump,2016-10-07,How Many Times Have Both Parties Nominated New Yorkers for President?,New York Times
trump,2016-10-08,The Sleaziness of Donald Trump,New York Times
trump,2016-10-08,Donald Trump’s Apology That Wasn’t,New York Times
trump,2016-10-08,"Donald Trump, Groper in Chief",New York Times
trump,2016-10-08,"Tough Donald Trump Coverage, if a Little Late",New York Times
trump,2016-10-08,Why Republicans Are Probably Stuck With Donald Trump,New York Times
trump,2016-10-08,Donald Trump’s Lewd Comments About Women,New York Times
trump,2016-10-08,Lewd Donald Trump Tape Is a Breaking Point for Many in the G.O.P.,New York Times
trump,2016-10-08,Those Who Don’t Understand Trump Are Doomed to Repeat Him,New York Times
trump,2016-10-08,Billy Bush Says He’s Ashamed by Lewd Talk With Donald Trump,New York Times
trump,2016-10-08,Transcript of Donald Trump’s Videotaped Apology,New York Times
trump,2016-10-09,Trump and Clinton’s Second Debate: Analysis,New York Times
trump,2016-10-09,How NBC Finished Second on the Trump Video Story,New York Times
trump,2016-10-09,Donald Trump Vows Retaliation as Republicans Abandon Him,New York Times
trump,2016-10-09,Men Say Trump’s Remarks on Sex and Women Are Beyond the Pale,New York Times
trump,2016-10-09,"Inside Trump Tower, an Increasingly Upset and Alone Donald Trump",New York Times
trump,2016-10-09,Donald Trump’s Loyalists Aren’t Fleeing the Latest Storm,New York Times
trump,2016-10-09,Donald Trump Highlights Breitbart Interview With Clinton Accuser,New York Times
trump,2016-10-09,Utah’s Top Mormons in ‘All-Out Revolt’ Against Donald Trump,New York Times
trump,2016-10-09,"Donald Trump the Showman, Now Caught in the Klieg Lights",New York Times
trump,2016-10-09,Donald Trump’s Long Record of Degrading Women,New York Times
trump,2016-10-10,Donald Trump Goes Low,New York Times
trump,2016-10-10,"Donald Trump, Barbarian at the Debate",New York Times
trump,2016-10-10,"Trump, the Next Big Short",New York Times
trump,2016-10-10,"Trump’s Second Debate, in Brief",New York Times
trump,2016-10-10,A Partisan Crowd Watches the Debate at the New Trump Hotel,New York Times
trump,2016-10-10,The Donald Trump We Always Knew,New York Times
trump,2016-10-10,Trump to Clinton: ‘You’d Be in Jail’,New York Times
trump,2016-10-10,"For G.O.P. Candidates, Renouncing Donald Trump Carries Dire Risks",New York Times
trump,2016-10-10,Trump and Clinton in Second Presidential Debate,New York Times
trump,2016-10-10,Donald Trump Acknowledges Not Paying Federal Income Taxes for Years,New York Times
trump,2016-10-11,Trumpism After Trump,New York Times
trump,2016-10-11,"Donald Trump’s Sad, Lonely Life",New York Times
trump,2016-10-11,Male Voters Finally Get Trump,New York Times
trump,2016-10-11,Count Trump Among the Takers,New York Times
trump,2016-10-11,Donald Trump Faltering? Die-Hard Fans Refuse to Buy It,New York Times
trump,2016-10-11,Chappatte on Donald Trump and Lady Liberty,New York Times
trump,2016-10-11,Why Donald Trump’s Words Matter,New York Times
trump,2016-10-11,Donald Trump Berates Paul Ryan and ‘Disloyal’ Republicans,New York Times
trump,2016-10-11,"Were He Seeking Any Other Job, Trump Would Be Flagged by H.R.",New York Times
trump,2016-10-11,Trump’s Threat to Jail Clinton Also Targets Democracy’s Institutions,New York Times
trump,2016-10-12,Donald Trump’s Weird World,New York Times
trump,2016-10-12,Trump and the Nuclear Keys,New York Times
trump,2016-10-12,Donald Trump’s Scary Election Day Gambit,New York Times
trump,2016-10-12,Trump Has Democrats Dreaming,New York Times
trump,2016-10-12,U.N. Official Calls Trump ‘Dangerous’,New York Times
trump,2016-10-12,Split Over Donald Trump Threatens to Tilt Republican States,New York Times
trump,2016-10-12,Some in G.O.P. Who Deserted Donald Trump Over Lewd Tape Are Returning,New York Times
trump,2016-10-12,Two Women Say Donald Trump Touched Them Inappropriately,New York Times
trump,2016-10-12,"Donald Trump Is ‘Dangerous’ for Global Stability, U.N. Rights Chief Says",New York Times
trump,2016-10-12,"A Senate Hopeful Veers From Republican Mainstream, and Toward Donald Trump",New York Times
trump,2016-10-13,What Donald Trump Is Right About,New York Times
trump,2016-10-13,Trump Versus Twitter,New York Times
trump,2016-10-13,"Donald Trump, Unshackled and Unhinged",New York Times
trump,2016-10-13,Donald Trump Threatens to Sue The Times Over Article on Unwanted Advances,New York Times
trump,2016-10-13,"Donald Trump, Slipping in Polls, Warns of ‘Stolen Election’",New York Times
trump,2016-10-13,Donald Trump Calls Allegations by Women ‘False Smears’,New York Times
trump,2016-10-13,How to Fix the Tax Code and Close Donald Trump’s Loopholes,New York Times
trump,2016-10-13,Writer for People Magazine Describes Forced Kiss by Trump,New York Times
trump,2016-10-13,"Voice Shaking, Michelle Obama Calls Trump Comments on Women ‘Intolerable’",New York Times
trump,2016-10-13,Women’s Accusations Drag Trump’s Behavior Back to Center Stage,New York Times
trump,2016-11-18,Donald Trump Agrees to Pay $25 Million in Trump University Settlement,New York Times
trump,2016-11-18,"Donald Trump, After Fits and Starts, Focuses on Foreign Policy",New York Times
trump,2016-11-18,"Michael Flynn, Anti-Islamist Ex-General, Offered Security Post, Trump Aide Says",New York Times
trump,2016-11-18,Trump Turns to His Right Flank to Fill National Security Posts,New York Times
trump,2016-11-18,Donald Trump Takes Credit for Helping to Save a Ford Plant That Wasn’t Closing,New York Times
trump,2016-11-18,Donald Trump’s Team Shows Few Signs of Post-Election Moderation,New York Times
trump,2016-11-18,Ivanka Trump’s Presence at Meeting With Japan’s Leader Raises Questions,New York Times
trump,2016-11-18,Donald Trump Seeks to Delay Action on Spending Bills Until His Term Starts,New York Times
trump,2016-11-18,"With National Security Choices, Trump Builds Team to Bulldoze Status Quo",New York Times
trump,2016-11-18,Trump Has Called Climate Change a Chinese Hoax. Beijing Says It Is Anything But.,New York Times
trump,2016-11-19,Enthusiasm for Trump in Poland Is Tempered by Distrust of Putin,New York Times
trump,2016-11-19,"‘Never Trump’ Stalwarts Try to Focus on Policy, Not the Man",New York Times
trump,2016-11-19,A Bleak Outlook for Trump’s Promises to Coal Miners,New York Times
trump,2016-11-19,Trump Adviser Takes Stake in China Ride-Sharing Company,New York Times
trump,2016-11-19,Diplomats Confront New Threat to Paris Climate Pact: Donald Trump,New York Times
trump,2016-11-19,Ex-General and Critic of Islam to Help Guide Trump in White House,New York Times
trump,2016-11-19,Muslim Americans Speak of Escalating Worries,New York Times
trump,2016-11-19,"Why Democrats Now Need the F.B.I. Director, James Comey",New York Times
trump,2016-11-19,"It’s Not Just the White House. Change Is in the Air on Wall St., Too",New York Times
trump,2016-11-19,"Oh, No! Donald Trump’s Calling",New York Times
trump,2016-11-20,Donald Trump and the Bieber Doctrine,New York Times
trump,2016-11-20,Indian Business Partners Hope to Exploit Their Ties to Donald Trump,New York Times
trump,2016-11-20,Donald Trump Meeting Suggests He Is Keeping Up His Business Ties,New York Times
trump,2016-11-20,Alec Baldwin Returns to ‘S.N.L.’ as President-Elect Trump,New York Times
trump,2016-11-20,Obama Tries to Reassure Latin America About a Future With Donald Trump,New York Times
trump,2016-11-20,What Trump’s Climate Legacy Could Look Like,New York Times
trump,2016-11-20,Kanye West Calls Out Beyoncé and Praises Trump in Onstage Tirade,New York Times
trump,2016-11-20,White Nationalists Celebrate ‘an Awakening’ After Donald Trump’s Victory,New York Times
trump,2016-11-20,Trump Turns Staid Process Into Spectacle as Aspirants Parade to His Door,New York Times
trump,2016-11-20,‘Hamilton’ Duel: Addressing the President-Elect on His Own Blunt Terms,New York Times
trump,2016-11-21,Trump Foundation Won’t Pay Any of $25 Million University Settlement,New York Times
trump,2016-11-21,"A List of Priorities From Trump, and Kris Kobach Tips His Hand",New York Times
trump,2016-11-21,Donald Trump’s Swamp Gets Murkier,New York Times
trump,2016-11-21,Trump Announces Policy Plans,New York Times
trump,2016-11-21,Melania and Barron Trump Won’t Immediately Move to White House,New York Times
trump,2016-11-21,"Where Donald Trump Stands on School Choice, Student Debt and Common Core",New York Times
trump,2016-11-21,How Hard (or Easy) It Will Be for Trump to Fulfill His 100-Day Plan,New York Times
trump,2016-11-21,Trump: Making America White Again,New York Times
trump,2016-11-21,Rally in Brooklyn Park Condemns Swastikas and ‘Go Trump’ Graffiti,New York Times
trump,2016-11-21,Alt-Right Gathering Exults in Trump Election With Nazi-Era Salute,New York Times
trump,2016-11-22,"Trump, on YouTube, Pledges to Create Jobs",New York Times
trump,2016-11-22,Gun Owners ‘Can Breathe Again’: Trump’s Win Emboldens Advocates,New York Times
trump,2016-11-22,Trump Foundation May Have Used Money to Benefit One of Its Own,New York Times
trump,2016-11-22,Donald Trump’s Business Dealings Test a Constitutional Limit,New York Times
trump,2016-11-22,"Grievances and Grumblings, Long Before Chris Christie’s Fall in Donald Trump’s Circle",New York Times
trump,2016-11-22,"Small Banks Cheer Trump. So, After a Pause, Do Big Ones.",New York Times
trump,2016-11-22,Civil Rights Groups Call on Trump to Denounce Racism of Alt-Right,New York Times
trump,2016-11-22,Donald Trump Drops Threat of New Hillary Clinton Investigation,New York Times
trump,2016-11-22,Mayor de Blasio Vows to Shield New Yorkers From Trump’s Policies,New York Times
trump,2016-11-22,Less Defiant Trump at The Times: ‘I Hope We Can All Get Along’,New York Times
trump,2016-11-23,"At Donald Trump’s Properties, a Showcase for a Brand and a President-Elect",New York Times
trump,2016-11-23,Donald Trump’s Early Backers in State Government May See Rewards,New York Times
trump,2016-11-23,Trump Diversifies Cabinet; Picks Nikki Haley and Betsy DeVos,New York Times
trump,2016-11-23,"In Betsy DeVos for Education, Trump Taps Into Michigan Royalty",New York Times
trump,2016-11-23,Donald Trump Close to Picking Ben Carson as Housing Secretary,New York Times
trump,2016-11-23,Book Publishers Scramble to Make Sense of Trump’s Rise to Victory,New York Times
trump,2016-11-23,Donald Trump’s New York Times Interview: Full Transcript,New York Times
trump,2016-11-23,Nikki Haley Chosen as U.N. Ambassador,New York Times
trump,2016-11-23,"Trump Tower, the Center of the Political Universe",New York Times
trump,2016-11-23,George Soros Pledges $10 Million to Fight Hate Crimes,New York Times
trump,2016-11-24,Trump to Accept Inauguration Funds From Corporations and Big Donors,New York Times
trump,2016-11-24,"Wilbur Ross, Billionaire Investor, Is Said to Be Trump’s Commerce Pick",New York Times
trump,2016-11-24,"A Battle to Change Medicare Is Brewing, Whether Trump Wants It or Not",New York Times
trump,2016-11-24,"Betsy DeVos, Trump’s Education Pick, Has Steered Money From Public Schools",New York Times
trump,2016-11-24,"Jared Kushner, Cast as Potential Player on Israel, Is Little Known There",New York Times
trump,2016-11-24,Carving Donald Trump,New York Times
trump,2016-11-24,Trump Cites Progress in Keeping Carrier Air Conditioning Plant in Indiana,New York Times
trump,2016-11-24,All the Clamor? Trump’s Palm Beach Neighbors See an Upside,New York Times
trump,2016-11-24,"Trump Signs, Trees and Accusations That a New York Agency Is Biased",New York Times
trump,2016-11-24,Would Trump Have Won Trump University Cases? Evidence Says He Faced Hard Fight,New York Times
trump,2016-11-25,"In Scotland, Trump Built a Wall. Then He Sent Residents the Bill.",New York Times
trump,2016-11-25,Trump Has Options for Undoing Obama’s Climate Legacy,New York Times
trump,2016-11-25,Republicans Divided Between Romney and Giuliani for Secretary of State,New York Times
trump,2016-11-25,Donald Trump and the Lawsuit Presidency,New York Times
trump,2016-11-25,How Trump Won the Troops,New York Times
trump,2016-11-25,Will Donald Trump Destroy the Iran Deal?,New York Times
trump,2016-11-25,Donald Trump Goes to Washington,New York Times
trump,2016-11-25,"With North Korea Looming, Trump May Be Rethinking China Showdown",New York Times
trump,2016-11-25,Donald Trump Adds K.T. McFarland to His National Security Team,New York Times
trump,2016-11-25,Remember When ‘Figaro’ Was Set in Trump Tower?,New York Times
trump,2016-11-26,"Potential Conflicts Around the Globe for Trump, the Businessman President",New York Times
trump,2016-11-26,"‘Vulture’ or ‘Phoenix’? Wilbur Ross, Risk-Taker, Is Eyed for Commerce Post",New York Times
trump,2016-11-26,"U.S. Officials Defend Integrity of Vote, Despite Hacking Fears",New York Times
trump,2016-11-26,Donald Trump’s Caldron of Conflicts,New York Times
trump,2016-11-26,The Soldier Donald Trump Called a Traitor,New York Times
trump,2016-11-26,The Pretend Populism of Donald Trump,New York Times
trump,2016-11-26,Trump’s Next Battle: Keeping These Republican Senators Happy,New York Times
trump,2016-11-26,A Donald Trump-Led Trip Back to the Gold-Plated ’80s,New York Times
trump,2016-11-26,Fate of U.S.-Cuba Thaw Is Less Certain Under Donald Trump,New York Times
trump,2016-11-26,"Trump Leans on Carrier to Keep 2,000 U.S. Jobs From Moving to Mexico",New York Times
trump,2016-11-27,"Trump Claims, With No Evidence, That ‘Millions of People’ Voted Illegally",New York Times
trump,2016-11-27,"Combative, Populist Steve Bannon Found His Man in Donald Trump",New York Times
trump,2016-11-27,Invoking Radicals of America’s Recent Past in a Politically Fraught Present,New York Times
trump,2016-11-27,South Korean Leader Digs In Against Rising Calls for Impeachment,New York Times
trump,2016-11-27,"Fidel Castro, Donald Trump, Cyber Monday: Your Weekend Briefing",New York Times
trump,2016-11-27,"Fidel Castro, François Fillon, Narendra Modi: Your Monday Briefing",New York Times
trump,2016-11-27,"At World Chess Championship, Familiar Overtones of East-West Politics",New York Times
trump,2016-11-27,Obama Expands War With Al Qaeda to Include Shabab in Somalia,New York Times
trump,2016-10-14,Erick Erickson: The G.O.P. After Donald Trump,New York Times
trump,2016-10-14,‘Never Trump.’ But Then What?,New York Times
trump,2016-10-14,Closing Trump’s Tax Loopholes,New York Times
trump,2016-10-14,Who Is to Blame for Trump’s Polling?,New York Times
trump,2016-10-14,Press Tensions at Trump Rallies,New York Times
trump,2016-10-14,Donald Trump vs. a Free Press,New York Times
trump,2016-10-14,"Trump as Champion of Working Class? ‘Come On,’ Obama Says",New York Times
trump,2016-10-14,"Donald Trump Assails His Accusers as Liars, and Unattractive",New York Times
trump,2016-10-14,"After Donald Trump, Will More Women Believe Their Own Stories?",New York Times
trump,2016-10-14,Where’s the Love for Trump? Not in Ads for G.O.P. Candidates,New York Times
trump,2016-10-15,Donald Trump and Other Animals,New York Times
trump,2016-10-15,How to Be a Man in the Age of Trump,New York Times
trump,2016-10-15,Trump Says Allegations Are ‘100% False’,New York Times
trump,2016-10-15,Magnate’s Twin Goals: Fighting Climate Change and Electing Donald Trump,New York Times
trump,2016-10-15,Where the Trump Name Is Emblazoned Now: The Front Yard,New York Times
trump,2016-10-15,Donald Trump’s Barrage of Heated Rhetoric Has Little Precedent,New York Times
trump,2016-10-15,"‘We Should Take a Drug Test’ Before Debate, Donald Trump Says",New York Times
trump,2016-10-15,Michelle Schools Donald Trump,New York Times
trump,2016-10-15,Issues in Hillary Clinton’s Past Leave Her Muted in Furor Over Donald Trump,New York Times
trump,2016-10-15,"As a Black Republican Senator, Tim Scott Faces a Unique Donald Trump Issue",New York Times
trump,2016-10-16,Officials Fight Donald Trump’s Claims of a Rigged Vote,New York Times
trump,2016-10-16,Donald Trump Says He’s a ‘Big Fan’ of Hindus,New York Times
trump,2016-10-16,Peter Thiel to Donate $1.25 Million in Support of Donald Trump,New York Times
trump,2016-10-16,"Hillary Clinton Builds $150 Million War Chest, Doubling Donald Trump",New York Times
trump,2016-10-16,"Donald Trump and the G.O.P.: The Party of Lincoln, Reagan and, Perhaps, Extinction",New York Times
trump,2016-10-16,"Specter of Trump Loosens Tongues, if Not Purse Strings, in Silicon Valley",New York Times
trump,2016-10-16,Ripples From the ‘How Low Can They Go’ Campaign,New York Times
trump,2016-10-16,The California Ballot Measure That Inspired a Tax Revolt,New York Times
trump,2016-10-16,"Corrections: October 16, 2016",New York Times
trump,2016-10-16,North Carolina G.O.P. Building Is Firebombed,New York Times
trump,2016-10-17,"Donald Trump, the Worst of America",New York Times
trump,2016-10-17,Donald Trump’s Playbook for Smearing,New York Times
trump,2016-10-17,The New Protesters Defying Donald Trump: His Customers,New York Times
trump,2016-10-17,"For Donald Trump, Lessons in Grace",New York Times
trump,2016-10-17,Audience Members Walk Out on Amy Schumer After Trump Criticisms,New York Times
trump,2016-10-17,Donald Trump Reveals Evangelical Rifts That Could Shape Politics for Years,New York Times
trump,2016-10-17,Why Trump Doubled Down on the Central Park Five,New York Times
trump,2016-10-17,‘They’re Lies’: Melania Trump Rejects Women’s Claims That Husband Groped Them,New York Times
trump,2016-10-17,Jared Kushner Talks of a Trump TV Network With a Media Deal Maker,New York Times
trump,2016-10-17,I Hardly Expected My Letter to Donald Trump to Go Viral,New York Times
trump,2016-10-18,Pledging the Trump Fraternity,New York Times
trump,2016-10-18,Obama to Trump: Stop Whining,New York Times
trump,2016-10-18,Trump Calls for Term Limits,New York Times
trump,2016-10-18,What Our Sons Are Learning From Donald Trump,New York Times
trump,2016-10-18,Shameful Silence on Donald Trump’s Lies About Vote-Rigging,New York Times
trump,2016-10-18,Donald Trump Says He Might Meet With Putin Before Inauguration,New York Times
trump,2016-10-18,Obama Tells Trump: Stop ‘Whining’ and Trying to Discredit the Election,New York Times
trump,2016-10-18,Hillary Clinton and Donald Trump Answer Your Questions,New York Times
trump,2016-10-18,"Trump Wants Big Changes to Legal Immigration, Too — How Big?",New York Times
trump,2016-10-18,Magazine Says Six People Corroborate Writer’s Claim Trump Assaulted Her,New York Times
trump,2016-10-19,The Trump Afterlife,New York Times
trump,2016-10-19,Trump in a Bikini,New York Times
trump,2016-10-19,Melania Trump Mimics Hillary Clinton to Defend Donald Trump,New York Times
trump,2016-10-19,The Religious Right’s Trump Schism,New York Times
trump,2016-10-19,Goldman Sachs C.E.O. on Trump,New York Times
trump,2016-10-19,Trump and Clinton’s Last Debate: Analysis,New York Times
trump,2016-10-19,Review: ‘Michael Moore in TrumpLand’ Isn’t About Donald Trump,New York Times
trump,2016-10-19,How Donald Trump Hacked the Politics of Foreign Policy,New York Times
trump,2016-10-19,Donald Trump’s Call to Monitor Polls Raises Fears of Intimidation,New York Times
trump,2016-10-19,How Silicon Valley Treats a Trump Backer: Peter Thiel,New York Times
trump,2016-10-20,Trump and Clinton on Abortion,New York Times
trump,2016-10-20,Was That a Presidential Debate or a Pitch for Trump TV?,New York Times
trump,2016-10-20,Donald Trump’s Contempt for Democracy,New York Times
trump,2016-10-20,A ‘Taco Wall’ to Protest Trump,New York Times
trump,2016-10-20,Donald Trump vs. American Democracy,New York Times
trump,2016-10-20,"Donald Trump Is Wrong on Mosul Attack, Military Experts Say",New York Times
trump,2016-10-20,Donald Trump Won’t Say if He’ll Accept Result of Election,New York Times
trump,2016-10-20,Trump and the ‘Rigged’ Emmy Awards: A History of Snubs,New York Times
trump,2016-10-20,Donald Trump Says He Will Accept Election Outcome (‘if I Win’),New York Times
trump,2016-10-20,A 10th Woman Accuses Donald Trump of Inappropriate Touching,New York Times
trump,2016-10-21,"Donald Trump, Enemy of Democracy",New York Times
