Candidate,Date,Headline,Site
trump,2016-10-21,Trump to Accelerate Campaign Schedule,New York Times
trump,2016-10-21,Donald Trump’s Theories of Constitutional Interpretation,New York Times
trump,2016-10-21,Trump Speaks at Al Smith Dinner,New York Times
trump,2016-10-21,Clinton Calls Trump Threat to Democracy,New York Times
trump,2016-10-21,Clinton Jabs Trump at Al Smith Dinner,New York Times
trump,2016-10-21,Trump and Clinton Both Accelerated Spending in September,New York Times
trump,2016-10-21,Donald Trump’s Defiance Is Seen as ‘Colossal Mistake’ That Threatens U.S. Image,New York Times
trump,2016-10-21,Trump the Anti-American,New York Times
trump,2016-10-21,"Trump in April: If I Lose, ‘I’ll Let It All Out’",New York Times
trump,2016-10-22,Mr. Gingrich’s ‘Big Trump’,New York Times
trump,2016-10-22,"Thank You, Donald Trump",New York Times
trump,2016-10-22,What Nixon Could Teach Trump About Losing,New York Times
trump,2016-10-22,Gay Republican Group Declines to Endorse Donald Trump,New York Times
trump,2016-10-22,Trump Recording Narrows Divide on Sexual Assault,New York Times
trump,2016-10-22,Donald Trump Pledges to ‘Heal Divisions’ (and Sue His Accusers),New York Times
trump,2016-10-22,The Clinton and Trump Foundations Are Vastly Different. Here’s How.,New York Times
trump,2016-10-22,Can Trump Help Us Bridge the ‘God Gulf’?,New York Times
trump,2016-10-22,John McCain’s Choice on Trump,New York Times
trump,2016-10-22,Donald Trump’s Warning on Election Result Sounds Familiar to Some Immigrants,New York Times
trump,2016-10-23,Hillary Clinton Presses Her Advantage Over a Struggling Donald Trump,New York Times
trump,2016-10-23,Donald Trump’s Threat to Reject Election Results Alarms Scholars,New York Times
trump,2016-10-23,G.O.P. Hopefuls in New York Races Walk Tightrope on Donald Trump,New York Times
trump,2016-10-23,Donald Trump Gets First Major Endorsement in Las Vegas,New York Times
trump,2016-10-23,‘Not a Regular Day’: What a Trump Rally Clash Reveals About a Divided Nation,New York Times
trump,2016-10-23,"With Tom Hanks Aboard, ‘S.N.L.’ Parodies Final Presidential Debate",New York Times
trump,2016-10-23,"Now at GQ, Keith Olbermann Takes His Outrage Online",New York Times
trump,2016-10-23,"Obama Assists 150 State Candidates, Targeting G.O.P.’s Grip on Legislatures",New York Times
trump,2016-10-23,On the Trail: Week of Oct. 16,New York Times
trump,2016-10-23,"AT&T, Chicago Cubs and Mosul: Your Weekend Briefing",New York Times
trump,2016-10-24,It’s Trump’s Party,New York Times
trump,2016-10-24,"What’s in a Name? When It’s ‘Trump Place,’ It’s a Revolt",New York Times
trump,2016-10-24,Sorting Out a ‘Big’ Trump Controversy,New York Times
trump,2016-10-24,"Yes, Trump Really Is Saying ‘Big League,’ Not ‘Bigly,’ Linguists Say",New York Times
trump,2016-10-24,"For Republicans Abandoning Donald Trump, Obama Has a Message: ‘Too Late’",New York Times
trump,2016-10-24,Clinton Leads Trump as Marathon Nears the Final Sprint,New York Times
trump,2016-10-24,"Donald Trump Dismisses Latest Accuser: ‘Oh, I’m Sure She’s Never Been Grabbed Before’",New York Times
trump,2016-10-24,"Fearing Trump, Bar Association Stifles Report Calling Him a ‘Libel Bully’",New York Times
trump,2016-10-24,Could Hillary Clinton Win Texas? Some Democrats Say Maybe,New York Times
trump,2016-10-24,WikiLeaks’ Gift to American Democracy,New York Times
trump,2016-10-25,"A New Trump Brand Not Named for Trump? Yes, Meet Scion",New York Times
trump,2016-10-25,Trump Rails Against Obamacare,New York Times
trump,2016-10-25,Is This Election Rigged Against Trump?,New York Times
trump,2016-10-25,Omarosa Manigault Changed Parties for Trump,New York Times
trump,2016-10-25,"What Drives Donald Trump? Fear of Losing Status, Tapes Show",New York Times
trump,2016-10-25,Obama Urges Democrats to Turn Out in Force Against Donald Trump and G.O.P.,New York Times
trump,2016-10-25,Consultant With Ties to Donald Trump Linked to Offer to Hide Source of Donations,New York Times
trump,2016-10-25,From ‘Hamilton’ to Donald Trump: Are All ‘Grievances’ Created Equal?,New York Times
trump,2016-10-25,"Seizing on Rising Costs, Trump Says Health Law Is ‘Over’",New York Times
trump,2016-10-25,‘I Had a Scary Dream About Donald Trump’: Muslim Parents Face a Tense Election,New York Times
trump,2016-10-26,Donald Trump the Candidate Promotes Trump the Brand on Campaign Trail,New York Times
trump,2016-10-26,How Donald Trump Used Hollywood to Create ‘Donald Trump’,New York Times
trump,2016-10-26,"Donald Trump, Alien to All That’s Great",New York Times
trump,2016-10-26,Trump Unveils Hotel in Washington,New York Times
trump,2016-10-26,"A Close Race for Darrell Issa, the House’s Mini-Trump",New York Times
trump,2016-10-26,Black Voters on Donald Trump: We’ve Heard It All Before,New York Times
trump,2016-10-26,Trump TV Offers (Fledgling) Framework for Potential Media Future,New York Times
trump,2016-10-26,Donald Trump’s Star on Hollywood Walk of Fame Is Smashed,New York Times
trump,2016-10-26,Donald Trump Allies Focus Anger on Another Target: G.O.P. Leaders,New York Times
trump,2016-10-26,"Women, the Military and Bill Clinton: Donald Trump on Tape",New York Times
trump,2016-10-27,How Do You Explain Trump in Russia?,New York Times
trump,2016-10-27,Emails With My Favorite Trump Supporter,New York Times
trump,2016-10-27,Donald Trump’s Lack of Discipline and Discernment,New York Times
trump,2016-10-27,Some Donald Trump Voters Warn of Revolution if Hillary Clinton Wins,New York Times
trump,2016-10-27,"Abandoning Donald Trump and, for Some Women, the G.O.P., Too",New York Times
trump,2016-10-27,"A Close Race for Darrell Issa, the House Mini-Trump",New York Times
trump,2016-10-27,Review: Another Look at Donald Trump’s Scottish Dealings,New York Times
trump,2016-10-27,Donald Trump Offers His Version of ‘New Deal for Black America’,New York Times
trump,2016-10-27,The Dark Days of Donald Trump,New York Times
trump,2016-10-27,"With a Politician’s Flair, Khizr Khan Tries to Push Clinton to Finish Line",New York Times
trump,2016-10-28,Donald Trump in Bollywood,New York Times
trump,2016-10-28,Blasting Out of a Trump Trap,New York Times
trump,2016-10-28,A Final Plea to Trump’s America,New York Times
trump,2016-10-28,New York Theater Artists’ Latest Muse: Donald Trump,New York Times
trump,2016-10-28,‘This Changes Everything’: Donald Trump Exults as Hillary Clinton’s Team Scrambles,New York Times
trump,2016-10-28,Sales in Trump Buildings Fall Off,New York Times
trump,2016-10-28,Will a Yuengling Executive’s Endorsement of Trump Hurt Beer Sales?,New York Times
trump,2016-10-28,Money Flows Down Ballot as Donald Trump Is Abandoned by Big Donors (Even Himself),New York Times
trump,2016-10-28,The Plot Against America or the Plot by America?,New York Times
trump,2016-10-28,How Pepe the Frog and Nasty Woman Are Shaping the Election,New York Times
trump,2016-10-29,The Dangers of Donald Trump,New York Times
trump,2016-10-29,Trump and the Conservationist,New York Times
trump,2016-10-29,Why Trump Stays Afloat,New York Times
trump,2016-10-29,Trump on New Clinton Email Inquiry,New York Times
trump,2016-10-29,Donald Trump Kicks In $10 Million to Campaign,New York Times
trump,2016-10-29,"Tarred by Trump, Paul Ryan Tries to Safeguard Both Party and Job",New York Times
trump,2016-10-29,Donald Trump Questions Veracity of Ballot Counting in Colorado,New York Times
trump,2016-10-29,Peter Thiel Defends His Most Contrarian Move Yet: Supporting Trump,New York Times
trump,2016-10-29,"Singing Hillary Clinton’s Praises, in Morgan Freeman’s Voice",New York Times
trump,2016-10-29,I Registered to Vote... For This?,New York Times
trump,2016-10-30,Latest Upshot Poll Shows Trump With a Lead in Florida,New York Times
trump,2016-10-30,Hillary Clinton Tries to Move Past Email Issue; Donald Trump Revels in It,New York Times
trump,2016-10-30,It’s on the Nose: Turbulence Often Strikes the Trump-Pence Planes,New York Times
trump,2016-10-30,"Black Voters, Aghast at Trump, Find a Place of Food and Comfort",New York Times
trump,2016-10-30,Early Turnout Tilts Toward Democrats in Swing States,New York Times
trump,2016-10-30,A Times Intern Connects With a Muslim Family in Staten Island,New York Times
trump,2016-10-30,Justice Department Obtains Warrant to Review Clinton Aide’s Emails,New York Times
trump,2016-10-30,Final Fed Meeting and Final Jobs Report Before Election Day,New York Times
trump,2016-10-30,10 Questions (and Answers) About New Email Trove,New York Times
trump,2016-10-30,"Canada and E.U. Sign Trade Deal, Bucking Resistance to Globalization",New York Times
trump,2016-10-31,Peter Thiel’s Fantasy Trump,New York Times
trump,2016-10-31,Thiel Defends Support for Trump,New York Times
trump,2016-10-31,"Latest Unpaid Trump Vendor Is His Own Pollster, Filing Shows",New York Times
trump,2016-10-31,Tech Billionaire Backing Trump Suggests Silicon Valley Is Out of Touch,New York Times
trump,2016-10-31,"Get Ready for Another Swing in the Polls, but Not Necessarily a Shift in the Race",New York Times
trump,2016-10-31,Making Sense of the Two Candidates’ Plans on Student Debt,New York Times
trump,2016-10-31,The R.N.C.’s ‘Don’t Get Out the Vote’ Drives,New York Times
trump,2016-10-31,"Ari Shavit, Celebrated Israeli Columnist, Resigns After Sexual Harassment Accusations",New York Times
trump,2016-10-31,"Emails, Genitalia and the F.B.I.",New York Times
trump,2016-10-31,"In War Between Candidates, Even F.B.I. Director Is a Target",New York Times
trump,2016-11-01,Trump’s Inconvenient Racial Truth,New York Times
trump,2016-11-01,What Happens to the Markets if Donald Trump Wins?,New York Times
trump,2016-11-01,Clinton Redirects Aim at Trump,New York Times
trump,2016-11-01,"In Missouri, Strapped to Mr. Trump",New York Times
trump,2016-11-01,Pussy Riot’s Nadya: Trump ‘Should Be Disqualified’,New York Times
trump,2016-11-01,Donald Trump’s Math Takes His Towers to Greater Heights,New York Times
trump,2016-11-01,Donald Trump Used Legally Dubious Method to Avoid Paying Taxes,New York Times
trump,2016-11-01,"Investigating Donald Trump, F.B.I. Sees No Clear Link to Russia",New York Times
trump,2016-11-01,"The ‘Normalization’ of Trump, and What Comes After",New York Times
trump,2016-11-01,"A Showman With an Anger That Ignites, and Limits, His Appeal",New York Times
trump,2016-11-02,"Avoiding Taxes, Trump-Style",New York Times
trump,2016-11-02,"Veterans, Feeling Abandoned, Stand by Donald Trump",New York Times
trump,2016-11-02,"Donald Trump Voters, Just Hear Me Out",New York Times
trump,2016-11-02,"Trump Probably Avoided His Medicare Taxes, Too",New York Times
trump,2016-11-02,A Senator’s ‘Bullseye’ Joke Echoes Trump,New York Times
trump,2016-11-02,"Trump, Waking a ‘Sleeping Giant,’ Helps Clinton Build an Unlikely Firewall",New York Times
trump,2016-11-02,Trump Adviser’s Slur Is a Sign of Things to Come,New York Times
trump,2016-11-02,Some Who Saw Change in Obama Find It Now in Donald Trump,New York Times
trump,2016-11-02,"Black Church Burned in Mississippi, With ‘Vote Trump’ Scrawled on Side",New York Times
trump,2016-11-02,"Presidential Election: Trump Hits $100 Million in Small Donations in October, Team Says",New York Times
trump,2016-11-03,5 Reasons to Vote Trump,New York Times
trump,2016-11-03,Is Donald Trump an American Hugo Chávez?,New York Times
trump,2016-11-03,Trump Is an Existential Threat,New York Times
trump,2016-11-03,Donald Trump Can’t Count on Those ‘Missing White Voters’,New York Times
trump,2016-11-03,"Donald Trump’s Income Isn’t Always What He Says It Is, Records Suggest",New York Times
trump,2016-11-03,Presidential Election: Melania Trump and Bernie Sanders to the Rescue,New York Times
trump,2016-11-03,"A Rare Moment of Unity on Capitol Hill, Thanks to Trump’s Taxes",New York Times
trump,2016-11-03,"Win or Lose, Trump Fans Vow to Fight On",New York Times
trump,2016-11-03,"Melania Trump, Solo in Pennsylvania, Tries to Smooth Husband’s Rough Edges",New York Times
trump,2016-11-03,Voters Express Disgust Over U.S. Politics in New Times/CBS Poll,New York Times
trump,2016-11-04, Donald Trump’s Impeachment Threat,New York Times
trump,2016-11-04,"Tax Reform, Thanks to Trump",New York Times
trump,2016-11-04,Donald Trump’s Moments and Missteps: A Look Back,New York Times
trump,2016-11-04,Big Names Campaigning for Hillary Clinton Underscore Donald Trump’s Isolation,New York Times
trump,2016-11-04,"As Trump Ally, Rudy Giuliani Boasts of Ties to F.B.I.",New York Times
trump,2016-11-04,Clinton and Trump Revealed: Our Best Investigative Reporting on the 2016 Campaign,New York Times
trump,2016-11-04,"Their Lives, Up Close: What We’ve Learned About Donald Trump and Hillary Clinton",New York Times
trump,2016-11-04,Clinton Pushes Minority Turnout as Trump Tries to Rally His Base,New York Times
trump,2016-11-04,Dreading a President Clinton or Trump? How to Try a New Country,New York Times
trump,2016-11-04,Presidential Election: Beyoncé and Jay Z Join Hillary Clinton,New York Times
trump,2016-11-05,Is There Life After Trump?,New York Times
trump,2016-11-05,Donald Trump’s Denial of Economic Reality,New York Times
trump,2016-11-05,In the Media Pen at a Trump Rally,New York Times
trump,2016-11-05,Thin Line Splits Donald Trump’s Politics and Businesses,New York Times
trump,2016-11-05,Beyond Lying: Donald Trump’s Authoritarian Reality,New York Times
trump,2016-11-05,Clinton Has Solid Lead in Electoral College; Trump’s Winning Map Is Unclear,New York Times
trump,2016-11-05,"Presidential Election: A Closing Act, With Clinton, Trump and a Tiny ‘Future Construction Worker’",New York Times
trump,2016-11-05,Iran’s Latest Propaganda Tool: The Clinton-Trump Debates on Live TV,New York Times
trump,2016-11-05,"A Guide to the Republican Herd, A Divided Pack of Elephants",New York Times
trump,2016-11-05,Imagining America on Nov. 9,New York Times
trump,2016-11-06,Inside Donald Trump’s Last Stand: An Anxious Nominee Seeks Assurance,New York Times
trump,2016-11-06,Donald Trump Rushed Offstage by Secret Service Agents,New York Times
trump,2016-11-06,"Why the Election Is Close, and What Trump and Obama Have in Common",New York Times
trump,2016-11-06,"For ‘S.N.L.,’ Clinton-Trump Has Been a Blessing and a Curse",New York Times
trump,2016-11-06,Presidential Election: No New Conclusion in Clinton Email Case,New York Times
trump,2016-11-06,The Biggest Turning Points in a Polarizing Campaign,New York Times
trump,2016-11-06,Voting With My Head and Heart,New York Times
trump,2016-11-06,How a Shop Owner in the Hamptons Knows Who Will Be President,New York Times
trump,2016-11-06,Our Reactionary Age,New York Times
trump,2016-11-06,Where Burning Effigies (Not Just Guy Fawkes’s) Is Part of the Fun,New York Times
trump,2016-11-07,Are There Really Hidden Trump Voters?,New York Times
trump,2016-11-07,Billionaire Turns Against Trump,New York Times
trump,2016-11-07,What Ivanka Trump Can’t Sell,New York Times
trump,2016-11-07,Burning Trump in Effigy on Bonfire Night,New York Times
trump,2016-11-07,Donald Trump’s Extremist Supporters Feel Like Winners Either Way,New York Times
trump,2016-11-07,Donald Trump’s Big Bet on Less Educated Whites,New York Times
trump,2016-11-07,Fear of Donald Trump Helps Democrats Mobilize Hispanics,New York Times
trump,2016-11-07,Trump and Clinton Tied in Final Upshot Poll of North Carolina,New York Times
trump,2016-11-07,Hillary Clinton and Donald Trump Scramble to Make Their Final Pleas,New York Times
trump,2016-11-07,Optimism From Hillary Clinton and Darkness From Donald Trump at Campaign’s End,New York Times
trump,2016-11-08,Donald Trump Votes,New York Times
trump,2016-11-08,"If Trump Wins Florida, It’s Because of These People",New York Times
trump,2016-11-08,Presidential Election Live: Donald Trump’s Victory,New York Times
trump,2016-11-08,Donald Trump Soaks in the Adulation in Improvised Final Stop,New York Times
trump,2016-11-08,How the Pro-Trump Media Covered Election Day,New York Times
trump,2016-11-08,"Donald Trump, Amid Cheers and Jeers, Casts His Vote",New York Times
trump,2016-11-08,"Did Tom Brady and Gisele Bündchen Back Donald Trump? She Says No, and He’s Not Saying",New York Times
trump,2016-11-08,Can the Media Recover From This Election?,New York Times
trump,2016-11-08,Election Night Live Coverage,New York Times
trump,2016-11-08,What 2016 Has Taught Us,New York Times
trump,2016-11-09,Donald Trump’s Revolt,New York Times
trump,2016-11-09,Donald Trump’s Shocking Success,New York Times
trump,2016-11-09,President Donald Trump,New York Times
trump,2016-11-09,Donald Trump Is Elected President in Stunning Repudiation of the Establishment,New York Times
trump,2016-11-09,Donald Trump’s Career Path,New York Times
trump,2016-11-09,Trump and Trudeau Policy Differences,New York Times
trump,2016-11-09,Mitch McConnell Congratulates Trump,New York Times
trump,2016-11-09,Inside the Trump Victory Party,New York Times
trump,2016-11-09,Donald Trump's Victory Speech,New York Times
trump,2016-11-09,Gritting Our Teeth and Giving President Trump a Chance,New York Times
trump,2016-11-10,"For Europe, Trump’s Election Is a Terrifying Disaster",New York Times
trump,2016-11-10,Are There Limits to Trump’s Power?,New York Times
trump,2016-11-10,Erick Erickson: Eating Crow on Donald Trump,New York Times
trump,2016-11-10,Trump Wasn’t in Aetna’s Playbook,New York Times
trump,2016-11-10,Ten-Step Program for Adjusting to President-Elect Trump,New York Times
trump,2016-11-10,President Obama Meets With Trump,New York Times
trump,2016-11-10,Being American in the Trump Years,New York Times
trump,2016-11-10,Trump Expected to Seek Deep Cuts in Business Regulations,New York Times
trump,2016-11-10,Trump and Obama Hold Cordial 90-Minute Meeting in Oval Office,New York Times
trump,2016-11-10,Daily Report: The Valley Awakens to Trump,New York Times
trump,2016-11-11,‘Never Trump’ Becomes ‘Maybe Trump’ in Foreign Policy Sphere,New York Times
trump,2016-11-11,The Market Rises With Trump,New York Times
trump,2016-11-11,Trump’s Economic Prescription. First: Do Harm.,New York Times
trump,2016-11-11,"Denounce the Hate, Mr. Trump",New York Times
trump,2016-11-11,The Women Who Helped Donald Trump to Victory,New York Times
trump,2016-11-11,What Is Donald Trump’s Foreign Policy?,New York Times
trump,2016-11-11,Donald Trump Gets to Work,New York Times
trump,2016-11-11,Religious Right Believes Donald Trump Will Deliver on His Promises,New York Times
trump,2016-11-11,"In Democratic Stronghold of New York City, Trump Finds Support Among Orthodox Jews",New York Times
trump,2016-11-11,American Companies Tailor Responses to Trump Election,New York Times
trump,2016-11-12,Trump and Identity,New York Times
trump,2016-11-12,You Must Serve Trump,New York Times
trump,2016-11-12,Obama Lobbies Against Obliteration by Trump,New York Times
trump,2016-11-12,Can Trump Save Their Jobs? They’re Counting on It,New York Times
trump,2016-11-12,Trump’s Hires Will Set Course of His Presidency,New York Times
trump,2016-11-12,What Europe Needs to Hear from Trump,New York Times
trump,2016-11-12,How Donald Trump Will Divide American and Israeli Jews,New York Times
trump,2016-11-12,The Trump Stock Rally: Calamity Averted With a Little Charm,New York Times
trump,2016-11-12,Lies in the Guise of News in the Trump Era,New York Times
trump,2016-11-12,International Readers on How a Trump Presidency Could Affect Them,New York Times
trump,2016-11-13,Dave Chappelle Hosts ‘S.N.L.’ and Addresses the Protests Against Trump,New York Times
trump,2016-11-13,"Donald Trump Shouldn’t ‘Put His Children Out of Work,’ Giuliani Says",New York Times
trump,2016-11-13,Donald Trump Picks Reince Priebus as Chief of Staff and Stephen Bannon as Strategist,New York Times
trump,2016-11-13,"Obama Heads Overseas, Where Topic of Trump Will Follow Him",New York Times
trump,2016-11-13,"Donald Trump Appears to Soften Stance on Immigration, but Not on Abortion",New York Times
trump,2016-11-13,European Leaders Gather to Grapple With Donald Trump’s Victory,New York Times
trump,2016-11-13,"Red, Blue and Divided: Six Views of America",New York Times
trump,2016-11-13,Historians Assess Obama’s Legacy Under Trump’s Shadow,New York Times
trump,2016-11-13,The Art Market’s Reaction to Trump? Sales This Week Offer First Test,New York Times
trump,2016-11-13,The Incendiary Appeal of Demagoguery in Our Time,New York Times
trump,2016-11-14,Trump Slump Coming?,New York Times
trump,2016-11-14,Sermons on Trump,New York Times
trump,2016-11-14,How Trump Is Good for China,New York Times
trump,2016-11-14,Where Will Trump Stand on Press Freedoms?,New York Times
trump,2016-11-14,Donald Trump Is Now Hiring,New York Times
trump,2016-11-14,Trump’s Rural White America,New York Times
trump,2016-11-14,"Syrian Rebels Brace for a Trump Cutoff, and Look for a Silver Lining",New York Times
trump,2016-11-14,"Greece, Seeking Dose of Stability, Is Rattled by Trump’s Win",New York Times
trump,2016-11-14,Heng on Trump’s Election and Its Implications for China,New York Times
trump,2016-11-14,Trump’s Supreme Court List: Ivy League? Out. The Heartland? In.,New York Times
trump,2016-11-15,Business or Politics? What Trump Means for Cuba,New York Times
trump,2016-11-15,"As Donald Trump Builds Team, the Right Scours His Blueprints",New York Times
trump,2016-11-15,Firings and Discord Put Trump Transition Team in a State of Disarray,New York Times
trump,2016-11-15,The Trump Effect on Tokyo,New York Times
trump,2016-11-15,Mexico Awaits Trump’s Next Move,New York Times
trump,2016-11-15,Trump’s Capitol Hill Problem,New York Times
trump,2016-11-15,"In China, Toilets Have Trump’s Name Without His Permission",New York Times
trump,2016-11-15,Ivanka Trump Blurs the Line Between Professional and Political,New York Times
trump,2016-11-15,"Trump Won the Election, but 3 Manhattan Buildings Will Lose His Name",New York Times
trump,2016-11-15,76 Experts Urge Donald Trump to Keep Iran Deal,New York Times
trump,2016-11-16,Catholic Bishops Challenge Donald Trump on Immigration,New York Times
trump,2016-11-16,Senate Democrats’ Surprising Strategy: Trying to Align With Trump,New York Times
trump,2016-11-16,"Trump Says Transition’s Going ‘Smoothly,’ Disputing Disarray Reports",New York Times
trump,2016-11-16,"As Trump Embraces Term Limits, Allies in Congress Pull Away",New York Times
trump,2016-11-16,Syrian President Calls Donald Trump a ‘Natural Ally’ in Fight Against Terrorism,New York Times
trump,2016-11-16,"Ivanka Trump and Jared Kushner Will Not Seek Security Clearances, Sources Say",New York Times
trump,2016-11-16,Trump’s Transition in a ‘Long History’ of Rocky Presidential Handovers,New York Times
trump,2016-11-16,"With Trump’s Signature, Dozens of Obama’s Rules Could Fall",New York Times
trump,2016-11-16,Megyn Kelly’s Cautionary Tale of Crossing Donald Trump,New York Times
trump,2016-11-16,"Under Donald Trump, Harsh Critic of V.A. May Become Its Leader",New York Times
trump,2016-11-17,Trump Team Sets Broader Limits on Lobbying by Former Staff,New York Times
trump,2016-11-17,Jeff Sessions Appears Headed to a Trump Cabinet Position,New York Times
trump,2016-11-17,"From Iran to Syria, Trump’s ‘America First’ Approach Faces Its First Tests",New York Times
trump,2016-11-17,"Specter of Race Shadows Jeff Sessions, Potential Trump Nominee for Cabinet",New York Times
trump,2016-11-17,"Donald Trump’s Son-in-Law, Jared Kushner, Tests Legal Path to White House Job",New York Times
trump,2016-11-17,Trump Will Have Wide Latitude to Let Family Into Government’s Secret Circles,New York Times
trump,2016-11-17,Yellen on Impact of Trump’s Election,New York Times
trump,2016-11-17,The Contradiction at the Heart of Donald Trump’s Economic Policy,New York Times
trump,2016-11-17,American Institute of Architects Apologizes for Statement of Support for Trump,New York Times
trump,2016-11-17,Trump-Size Idea for a New President: Build Something Inspiring,New York Times
clinton,2016-10-01,"Hillary Clinton’s Positive Message? That Was the Plan, at Least",New York Times
clinton,2016-10-01,Donald Trump Opens New Line of Attack on Hillary Clinton: Her Marriage,New York Times
clinton,2016-10-01,Hillary Clinton and Democrats Raised $154 Million in September,New York Times
clinton,2016-10-01,"After Trump-Clinton, Vice-Presidential Debate Isn’t Exactly ‘the Return of Elvis’",New York Times
clinton,2016-10-01,New Hillary Clinton Ads Look to Expand Lead With Hispanic Voters,New York Times
clinton,2016-10-01,Report That Donald Trump Did Business in Cuba Ups the Ante in Florida,New York Times
clinton,2016-10-01,Trump Infrastructure Plan’s Fatal Flaw,New York Times
clinton,2016-10-01,How Could Anyone Vote for Trump?,New York Times
clinton,2016-10-01,Girl Talk at Trump Tower,New York Times
clinton,2016-10-01,¡A votar! Latino Voters Can Make a Difference,New York Times
clinton,2016-10-02,Donald Trump Criticizes Hillary Clinton,New York Times
clinton,2016-10-02,"Rudy Giuliani, Continuing Rebuke of Hillary Clinton, Says ‘Everybody’ Commits Infidelity",New York Times
clinton,2016-10-02,‘S.N.L.’ Begins a New Season With Alec Baldwin as Donald Trump,New York Times
clinton,2016-10-02,Donald Trump Suggests Hillary Clinton Isn’t ‘Loyal to Bill’,New York Times
clinton,2016-10-02,"Donald Trump, Hillary Clinton, Hoboken: Your Weekend Briefing",New York Times
clinton,2016-10-02,Donald Trump and His Allies Struggle to Move Past Tax Revelation,New York Times
clinton,2016-10-02,"Corrections: October 2, 2016",New York Times
clinton,2016-10-02,"Sharon Skettini, Leo Clavijo",New York Times
clinton,2016-10-02,Who Is the Real Elena Ferrante? Italian Journalist Reveals His Answer,New York Times
