Candidate,Date,Headline,Site
clinton,2016-10-02,Alicia Machado vs. Donald Trump’s Machismo,New York Times
clinton,2016-10-03,"How Hillary Clinton Grappled With Bill Clinton’s Infidelity, and His Accusers",New York Times
clinton,2016-10-03,Clinton Hits Trump on Taxes,New York Times
clinton,2016-10-03,"Hillary Clinton, Seizing on Tax Returns, Says Donald Trump Embodies ‘Rigged System’",New York Times
clinton,2016-10-03,"LeBron James, Calling for Hope and Unity, Endorses Hillary Clinton",New York Times
clinton,2016-10-03,Trump’s Fellow Travelers,New York Times
clinton,2016-10-03,Tim Kaine and Mike Pence Prepare for Vice-Presidential Proxy Fight,New York Times
clinton,2016-10-03,The Trump Possibility,New York Times
clinton,2016-10-03,Trump’s Tax (Avoidance) Plan,New York Times
clinton,2016-10-03,Ailing Obama Health Care Act May Have to Change to Survive,New York Times
clinton,2016-10-03,"Donald Trump, FARC, Ryder Cup: Your Monday Briefing",New York Times
clinton,2016-10-04,"Better Polling for Clinton, but Trump Is Keeping Core Support",New York Times
clinton,2016-10-04,Clinton Talks to Teen About Body Image,New York Times
clinton,2016-10-04,Hillary Clinton to Girl’s Question on Body Image: ‘Let’s Be Proud of Who We Are.’,New York Times
clinton,2016-10-04,A Look at Clinton’s Marriage Woes Raises a Question: Really?,New York Times
clinton,2016-10-04,Assange Says He Has No Intention to Harm Clinton,New York Times
clinton,2016-10-04,Hillary Clinton’s Lonesome White Male Supporters,New York Times
clinton,2016-10-04,Vice-Presidential Debate: What You Missed,New York Times
clinton,2016-10-04,Third-Party Voters Know What They Want,New York Times
clinton,2016-10-04,"Julian Assange, WikiLeaks Founder, Promises Raft of Revelations",New York Times
clinton,2016-10-04,"With Tim Kaine and Mike Pence, Faith Is Back in the Mix",New York Times
clinton,2016-10-05,Pence on Clinton’s ‘Deplorables’ Comment,New York Times
clinton,2016-10-05,"In Visceral Ads for Hillary Clinton, Donald Trump Does All the Talking",New York Times
clinton,2016-10-05,Fact Checks of the Vice-Presidential Debate,New York Times
clinton,2016-10-05,"Hashtags, Polls and Putin: Aftermath of the Vice-Presidential Debate",New York Times
clinton,2016-10-05,"After Mike Pence’s Debate Showing, Donald Trump Takes Credit",New York Times
clinton,2016-10-05,Tim Kaine and Mike Pence Clash Sharply Over Their Running Mates,New York Times
clinton,2016-10-05,‘That Mexican Thing’ Takes On Life After the Debate,New York Times
clinton,2016-10-05,Mike Pence’s Galling Amnesia,New York Times
clinton,2016-10-05,The Vice Presidential Debate,New York Times
clinton,2016-10-05,Donald Trump as Role Model? G.O.P. Senator ‘Absolutely’ Has Second Thoughts,New York Times
clinton,2016-10-06,Want to Know the Crucial Areas for Clinton? Follow Michelle Obama,New York Times
clinton,2016-10-06,Who’s Sorry Now? The Country,New York Times
clinton,2016-10-06,Gary Johnson Equates Syria Deaths Caused by Assad and West,New York Times
clinton,2016-10-06,Megyn Kelly and Sean Hannity Indulge in Testy Public Clash,New York Times
clinton,2016-10-06,"Debates Past, and Debates Future",New York Times
clinton,2016-10-06,Pro-Trump Group to Release Ads as Part of Major Swing State Effort,New York Times
clinton,2016-10-06,"Civil Conversation Challenge for Teenagers | Issue 4: Race, Gender and Identity",New York Times
clinton,2016-10-06,Tim Kaine Criticizes Gary Johnson Over Syria Remarks,New York Times
clinton,2016-10-06,Protest Against Fox Correspondent Accused of Racism for Chinatown Interviews,New York Times
clinton,2016-10-06,"Global Trade War, Trump Edition",New York Times
clinton,2016-10-07,"Clinton and Kaine, Struggling on Taxes",New York Times
clinton,2016-10-07,"How This Jobs Report Can Help Clinton, and Trump",New York Times
clinton,2016-10-07,"A Must-Win Debate for Donald Trump, but Not a Must-Rehearse One",New York Times
clinton,2016-10-07,"Balance, Trump and Lies",New York Times
clinton,2016-10-07,What About the Planet?,New York Times
clinton,2016-10-07,Democrats Push to Extend Voter Registration in Storm-Damaged Florida,New York Times
clinton,2016-10-07,The Second 2016 Presidential Debate: A Place for Student Predictions and Reactions,New York Times
clinton,2016-10-07,The Economy Is Strong But Slowing,New York Times
clinton,2016-10-07,How Many Times Have Both Parties Nominated New Yorkers for President?,New York Times
clinton,2016-10-07,When Trump vs. Clinton Becomes a Family Affair,New York Times
clinton,2016-10-08,Hillary Clinton’s Poisoned Prize,New York Times
clinton,2016-10-08,Leaked Speech Excerpts Show a Hillary Clinton at Ease With Wall Street,New York Times
clinton,2016-10-08,"To Redefine Homestretch, Hillary Clinton Cues the Children",New York Times
clinton,2016-10-08,Transcript of Donald Trump’s Videotaped Apology,New York Times
clinton,2016-10-08,John McCain Withdraws Support for Donald Trump After Disclosure of Recording,New York Times
clinton,2016-10-08,What’s God Got to Do With It?,New York Times
clinton,2016-10-08,Surveillance in the Post-Obama Era,New York Times
clinton,2016-10-08,Is Idealism Missing From the Presidential Campaign?,New York Times
clinton,2016-10-08,Newly Released Hillary Clinton Emails Offer Glimpse at Husband’s Advice,New York Times
clinton,2016-10-08,On the Trail: Week of Oct. 2,New York Times
clinton,2016-10-09,Trump and Clinton’s Second Debate: Analysis,New York Times
clinton,2016-10-09,Hating Hillary Clinton: Female Comics Skewer the Sexism of the Likability Trap,New York Times
clinton,2016-10-09,Donald Trump Highlights Breitbart Interview With Clinton Accuser,New York Times
clinton,2016-10-09,Presidential Debate: Here’s What You Missed,New York Times
clinton,2016-10-09,What to Expect From the Second Debate,New York Times
clinton,2016-10-09,"Inside Trump Tower, an Increasingly Upset and Alone Donald Trump",New York Times
clinton,2016-10-09,Donald Trump’s Loyalists Aren’t Fleeing the Latest Storm,New York Times
clinton,2016-10-09,"Women React With Fury to Donald Trump’s Remarks, but Some Offer Support",New York Times
clinton,2016-10-09,"Donald Trump the Showman, Now Caught in the Klieg Lights",New York Times
clinton,2016-10-09,Donald Trump Vows Retaliation as Republicans Abandon Him,New York Times
clinton,2016-10-10,Trump to Clinton: ‘You’d Be in Jail’,New York Times
clinton,2016-10-10,Trump and Clinton in Second Presidential Debate,New York Times
clinton,2016-10-10,Is Ralph Lauren Going to Be Hillary Clinton’s Dresser in Chief?,New York Times
clinton,2016-10-10,Highlights From the Clinton Campaign Emails: How to Deal With Sanders and Biden,New York Times
clinton,2016-10-10,"Debate Takeaways: Clinton Is Still Standing, and Trump Isn’t Going Away",New York Times
clinton,2016-10-10,Donald Trump Featured Paula Jones and 2 Other Women Who Accused Bill Clinton of Sexual Assault,New York Times
clinton,2016-10-10,"In Second Debate, Donald Trump and Hillary Clinton Spar in Bitter, Personal Terms",New York Times
clinton,2016-10-10,What Story Did Debate Night Body Language Tell?,New York Times
clinton,2016-10-10,Fact Checks of the Second Presidential Debate,New York Times
clinton,2016-10-10,Was That a Debate? Or Were the Candidates Just Trying to Go Viral?,New York Times
clinton,2016-10-19,Trump and Clinton’s Last Debate: Analysis,New York Times
clinton,2016-10-19,Melania Trump Mimics Hillary Clinton to Defend Donald Trump,New York Times
clinton,2016-10-19,Ex-F.B.I. Official Acknowledges Role in New Clinton Email Controversy,New York Times
clinton,2016-10-19,"At Previous Debates, Melania Trump and Bill Clinton Shook Hands. Not Anymore.",New York Times
clinton,2016-10-19,When Hillary Clinton Tested New Slogans — 85 of Them,New York Times
clinton,2016-10-19,Presidential Debate: What You Missed,New York Times
clinton,2016-10-19,Abbi Jacobson Didn’t Expect Hillary Clinton to Come on Her Show,New York Times
clinton,2016-10-19,Do Campaign Ads Matter? Donald Trump Offers a Rare Chance to Find Out,New York Times
clinton,2016-10-19,Julian Assange of WikiLeaks Unplugged,New York Times
clinton,2016-10-19,12 Questions We’d Like to Hear at the Presidential Debate,New York Times
clinton,2016-10-20,Trump and Clinton on Abortion,New York Times
clinton,2016-10-20,"Hillary Clinton, Mocking and Taunting in Debate, Turns the Tormentor",New York Times
clinton,2016-10-20,The Nickname Hillary Clinton Has Been Waiting For,New York Times
clinton,2016-10-20,Clinton and Trump Do Battle in the Final Presidential Debate,New York Times
clinton,2016-10-20,"Trump, 5; Clinton, 1: Statements at Odds With the Constitution",New York Times
clinton,2016-10-20,Hillary Clinton Told People to Google ‘Donald Trump Iraq.’ They Did.,New York Times
clinton,2016-10-20,Workplace Politics (the Trump-Clinton Kind),New York Times
clinton,2016-10-20,In Clinton Hill: Their First Apartment Together,New York Times
clinton,2016-10-20,Donald Trump Won’t Say if He’ll Accept Result of Election,New York Times
clinton,2016-10-20,"Debate Takeaways: Donald Trump Had a Lot to Do, and He Didn’t Do It",New York Times
clinton,2016-10-21,Hillary Clinton Makes Pitch for Mandate and a Swing-State Sweep,New York Times
clinton,2016-10-21,"In Debate, Hillary Clinton’s Clarion Call for Women Thrills Many",New York Times
clinton,2016-10-21,Clinton Calls Trump Threat to Democracy,New York Times
clinton,2016-10-21,Trump and Clinton Both Accelerated Spending in September,New York Times
clinton,2016-10-21,Clinton Jabs Trump at Al Smith Dinner,New York Times
clinton,2016-10-21,Debate-Watching With Hillary Clinton’s BFFs,New York Times
clinton,2016-10-21,Men Need Help. Is Hillary Clinton the Answer?,New York Times
clinton,2016-10-21,"The Hawk on Russia Policy? Hillary Clinton, Not Donald Trump",New York Times
clinton,2016-10-21,Private Security Group Says Russia Was Behind John Podesta’s Email Hack,New York Times
clinton,2016-10-21,Why Hillary Wins,New York Times
clinton,2016-10-22,The Dangers of Hillary Clinton,New York Times
clinton,2016-10-22,A WikiLeaks Lesson for Mrs. Clinton,New York Times
clinton,2016-10-22,Trump and Clinton Turn Each Other’s Words to Their Advantage,New York Times
clinton,2016-10-22,"Philippines ‘Separation’ From U.S. Jilts Hillary Clinton, Too",New York Times
clinton,2016-10-22,The Clinton and Trump Foundations Are Vastly Different. Here’s How.,New York Times
clinton,2016-10-22,Why Hillary Clinton Needs to Be Two-Faced,New York Times
clinton,2016-10-22,Outside Money Favors Hillary Clinton at a 2-to-1 Rate Over Donald Trump,New York Times
clinton,2016-10-22,A Constellation of Influencers: Behind the Curtain at Teneo,New York Times
clinton,2016-10-22,The Witching Season,New York Times
clinton,2016-10-22,"If They Google You, Do You Win?",New York Times
clinton,2016-10-23,"True or False? Hillary Clinton, a Native Chicagoan, Is a Cubs Fan",New York Times
clinton,2016-10-23,Hillary Clinton Presses Her Advantage Over a Struggling Donald Trump,New York Times
clinton,2016-10-23,"With Tom Hanks Aboard, ‘S.N.L.’ Parodies Final Presidential Debate",New York Times
clinton,2016-10-23,Donald Trump Gets First Major Endorsement in Las Vegas,New York Times
clinton,2016-10-23,On the Trail: Week of Oct. 16,New York Times
clinton,2016-10-23,G.O.P. Hopefuls in New York Races Walk Tightrope on Donald Trump,New York Times
clinton,2016-10-23,"AT&T, Chicago Cubs and Mosul: Your Weekend Briefing",New York Times
clinton,2016-10-23,Regulatory Microscope Lies Ahead for AT&T and Time Warner,New York Times
clinton,2016-10-23,The Corporate Confidence of the AT&T-Time Warner Deal,New York Times
clinton,2016-10-23,"Obama Assists 150 State Candidates, Targeting G.O.P.’s Grip on Legislatures",New York Times
clinton,2016-10-24,Clinton’s Specter of Illegitimacy,New York Times
clinton,2016-10-24,Liberals Hope Elizabeth Warren Will Serve as Clinton’s Scrutinizer in Chief,New York Times
clinton,2016-10-24,Black Democrats to Hillary Clinton: Send Money to Take Congress,New York Times
clinton,2016-10-24,Could Hillary Clinton Win Texas? Some Democrats Say Maybe,New York Times
clinton,2016-10-24,Clinton Leads Trump as Marathon Nears the Final Sprint,New York Times
clinton,2016-10-24,"To Flip the House, How Big Would a Clinton Victory Margin Need to Be?",New York Times
clinton,2016-10-24,Elizabeth Warren: ‘Nasty Women Vote’,New York Times
clinton,2016-10-24,WikiLeaks’ Gift to American Democracy,New York Times
clinton,2016-10-24,"Some Health Plan Costs to Increase by an Average of 25 Percent, U.S. Says",New York Times
clinton,2016-10-24,"Election Chatter, With Two Weeks to Go",New York Times
clinton,2016-10-25,Clinton Leads by 7 Points in North Carolina Poll,New York Times
clinton,2016-10-25,‘We Need to Clean This Up’: Clinton Aide’s Newly Public Email Shows Concern,New York Times
clinton,2016-10-25,"Seizing on Rising Costs, Trump Says Health Law Is ‘Over’",New York Times
clinton,2016-10-25,Obama Urges Democrats to Turn Out in Force Against Donald Trump and G.O.P.,New York Times
clinton,2016-10-25,The Unhappy Warriors,New York Times
clinton,2016-10-25,"Voters Fear Their Ballot Won’t Count, Poll Shows",New York Times
clinton,2016-10-25,The Problem for Women Is Not Winning. It’s Deciding to Run.,New York Times
clinton,2016-10-25,Voter Attitudes Toward Hillary Clinton,New York Times
clinton,2016-10-25,Colin Powell Says He’ll Vote for Hillary Clinton,New York Times
clinton,2016-10-25,"Calais Jungle, Mosul, Clinton: Your Tuesday Briefing",New York Times
clinton,2016-10-26,Hillary Clinton’s Resounding Mandate,New York Times
clinton,2016-10-26,"It’s Someone’s Birthday? Yes It Is, Clinton Campaign Says",New York Times
clinton,2016-10-26,"Hillary Clinton Gains Some Ground Among Young Voters, Poll Finds",New York Times
clinton,2016-10-26,"Republicans in Congress Fear Losses, and Then the Hard Part",New York Times
clinton,2016-10-26,Newt Gingrich’s Strange Fascination With Sex,New York Times
clinton,2016-10-26,Donald Trump Allies Focus Anger on Another Target: G.O.P. Leaders,New York Times
clinton,2016-10-26,The Least Useful Place for a Republican Nominee to Go?,New York Times
clinton,2016-10-26,The Most Awkward Dinner Party of the Year,New York Times
clinton,2016-10-26,Protests and Storms Make North Carolina’s Election Year ‘a Bizarre Experience’,New York Times
clinton,2016-10-26,The Uninvited Guest: The 2016 Campaign Crashes the Dinner Party,New York Times
clinton,2016-10-27,"Donations to Foundation Vexed Hillary Clinton’s Aides, Emails Show",New York Times
clinton,2016-10-27,Clinton and Michelle Obama Campaign Together,New York Times
clinton,2016-10-27,Some Donald Trump Voters Warn of Revolution if Hillary Clinton Wins,New York Times
clinton,2016-10-27,"With a Politician’s Flair, Khizr Khan Tries to Push Clinton to Finish Line",New York Times
clinton,2016-10-27,Hillary Clinton Basks in First Lady’s Soaring Popularity on the Campaign Trail,New York Times
clinton,2016-10-27,Hillary Clinton Leads by 7 Points in Pennsylvania Poll,New York Times
clinton,2016-10-27,Michelle Obama to Join Hillary Clinton at North Carolina Rally,New York Times
clinton,2016-10-27,How Do You Explain Trump in Russia?,New York Times
clinton,2016-10-27,The Great Democratic Inversion,New York Times
clinton,2016-10-27,The Dark Days of Donald Trump,New York Times
clinton,2016-10-28,Chelsea Clinton’s Frustrations and Devotion Shown in Hacked Emails,New York Times
clinton,2016-10-28,The Road Trip That Changed Hillary Clinton’s Life,New York Times
clinton,2016-10-28,Emails in Anthony Weiner Inquiry Jolt Hillary Clinton’s Campaign,New York Times
clinton,2016-10-28,Letter to Congress From F.B.I. Director on Clinton Email Case,New York Times
clinton,2016-10-28,‘This Changes Everything’: Donald Trump Exults as Hillary Clinton’s Team Scrambles,New York Times
clinton,2016-10-28,"Donald Trump Campaign Seeks ‘Voter Suppression,’ Report Says, but It’s Legal",New York Times
clinton,2016-10-28,"Ads That Use Candidates’ Own Words, to Powerful Effect",New York Times
clinton,2016-10-28,Key Moments in the Downfall of Anthony Weiner,New York Times
clinton,2016-10-28,When Hillary Rodham Took to the Road,New York Times
clinton,2016-10-28,Money Flows Down Ballot as Donald Trump Is Abandoned by Big Donors (Even Himself),New York Times
clinton,2016-10-11,Emails Show How Clinton Aides Stage-Managed Her Keystone Shift,New York Times
clinton,2016-10-11,"Hillary Clinton’s Campaign Strained to Hone Her Message, Hacked Emails Show",New York Times
clinton,2016-10-11,"Al Gore, With Hillary Clinton, Reminds Florida: ‘Every. Single. Vote. Counts.’",New York Times
clinton,2016-10-11,"Obama, in North Carolina, Lashes Trump as He Urges Blacks to Back Clinton",New York Times
clinton,2016-10-11,"Hillary Clinton Aides Kept de Blasio at Arm’s Length, WikiLeaks Emails Show",New York Times
clinton,2016-10-11,Trump’s Threat to Jail Clinton Also Targets Democracy’s Institutions,New York Times
clinton,2016-10-11,"Threat to Jail Clinton Smacks of ‘Tin-Pot Dictators,’ Experts Say",New York Times
clinton,2016-10-11,What’s Really Behind Trump’s Obsession With Clinton’s ‘Stamina’?,New York Times
clinton,2016-10-11,Early Voting Could Point to Hillary Clinton Victory Well Before Nov. 8,New York Times
clinton,2016-10-11,"Glenn Beck Says Opposing Trump Is ‘Moral, Ethical’ Even if It Means Clinton Wins",New York Times
clinton,2016-10-12,Group’s Tactic on Hillary Clinton: Sue Her Again and Again,New York Times
clinton,2016-10-12,WikiLeaks Emails Show Mayor de Blasio Venting at and Appealing to Clinton Campaign,New York Times
clinton,2016-10-12,John Podesta Says Russian Spies Hacked His Emails to Sway Election,New York Times
clinton,2016-10-12,Split Over Donald Trump Threatens to Tilt Republican States,New York Times
clinton,2016-10-12,Obama Considers ‘Proportional’ Response to Russian Hacking in U.S. Election,New York Times
clinton,2016-10-12,Can the U.S. Win This Election?,New York Times
clinton,2016-10-12,Answering the Call of the Election Season,New York Times
clinton,2016-10-12,Russell Moore Can’t Support Either Candidate,New York Times
clinton,2016-10-12,"In City Built by Immigrants, Immigration Is the Defining Political Issue",New York Times
clinton,2016-10-12,Trump Has Democrats Dreaming,New York Times
clinton,2016-10-13,"Handling Cows by Day, Ever-Growing Clinton Rallies by Night",New York Times
clinton,2016-10-13,"As Donald Trump Stumbles, Hillary Clinton Watches Her Step",New York Times
clinton,2016-10-13,He Calls Hillary Clinton a ‘Demon.’ Who Is Alex Jones?,New York Times
clinton,2016-10-13,Review: The Anti-Clinton Brigade’s Four-Letter Word Obsession,New York Times
clinton,2016-10-13,Donald Trump Finds Improbable Ally in WikiLeaks,New York Times
clinton,2016-10-13,"Voice Shaking, Michelle Obama Calls Trump Comments on Women ‘Intolerable’",New York Times
clinton,2016-10-13,How Red States Turn Blue (and Vice Versa),New York Times
clinton,2016-10-13,"Donald Trump, Slipping in Polls, Warns of ‘Stolen Election’",New York Times
clinton,2016-10-13,The Perpetual Panic of American Parenthood,New York Times
clinton,2016-10-13,How to Fix the Tax Code and Close Donald Trump’s Loopholes,New York Times
clinton,2016-10-14,The Clinton Agenda,New York Times
clinton,2016-10-14,Trump Accuses Clinton of Guiding Global Elite Against U.S. Working Class,New York Times
clinton,2016-10-14,Anatomy of a Media Conspiracy,New York Times
clinton,2016-10-14,"Trump as Champion of Working Class? ‘Come On,’ Obama Says",New York Times
clinton,2016-10-14,"Donald Trump Assails His Accusers as Liars, and Unattractive",New York Times
clinton,2016-10-14,Is G.O.P. Dodging a Landslide? Trump’s Polling Hasn’t Collapsed (Yet),New York Times
clinton,2016-10-14,Gender Issues in Sharp Focus at The Times,New York Times
clinton,2016-10-14,"After Donald Trump, Will More Women Believe Their Own Stories?",New York Times
clinton,2016-10-14,"Race, and the G.O.P.’s Future",New York Times
clinton,2016-10-14,Revelations From the Final Weeks,New York Times
clinton,2016-10-15,If Hillary Clinton Groped Men,New York Times
clinton,2016-10-15,Issues in Hillary Clinton’s Past Leave Her Muted in Furor Over Donald Trump,New York Times
clinton,2016-10-15,"Urging Blacks to Vote for Clinton for Obama’s Sake, and Their Own",New York Times
clinton,2016-10-15,"‘We Should Take a Drug Test’ Before Debate, Donald Trump Says",New York Times
clinton,2016-10-15,The Other Campaign Madness: Mega-Donors,New York Times
clinton,2016-10-15,Where the Trump Name Is Emblazoned Now: The Front Yard,New York Times
clinton,2016-10-15,How Turned Off Are Voters? Check Out Tommy’s Diner,New York Times
clinton,2016-10-15,The Authentic Power of Michelle Obama,New York Times
clinton,2016-10-15,Donald Trump’s Barrage of Heated Rhetoric Has Little Precedent,New York Times
clinton,2016-10-15,In Defense of the Religious Right,New York Times
clinton,2016-10-16,Haiti and Africa Projects Shed Light on Clinton’s Public-Private Web,New York Times
clinton,2016-10-16,Hacked Transcripts Reveal a Genial Hillary Clinton at Goldman Sachs Events,New York Times
clinton,2016-10-16,"Hillary Clinton Builds $150 Million War Chest, Doubling Donald Trump",New York Times
clinton,2016-10-16,Email About Qatari Offer Shows Thorny Ethical Issues Clinton Foundation Faced,New York Times
clinton,2016-10-16,Ripples From the ‘How Low Can They Go’ Campaign,New York Times
clinton,2016-10-16,"Specter of Trump Loosens Tongues, if Not Purse Strings, in Silicon Valley",New York Times
clinton,2016-10-16,"Donald Trump and the G.O.P.: The Party of Lincoln, Reagan and, Perhaps, Extinction",New York Times
clinton,2016-10-16,Donald Trump Says He’s a ‘Big Fan’ of Hindus,New York Times
clinton,2016-10-16,North Carolina G.O.P. Building Is Firebombed,New York Times
clinton,2016-10-16,"Long Before Kaepernick, There Was Navratilova",New York Times
clinton,2016-10-17,"Showing Confidence, Hillary Clinton Pushes Into Republican Strongholds",New York Times
clinton,2016-10-17,"Hillary Clinton Liked Covert Action if It Stayed Covert, Transcript Shows",New York Times
clinton,2016-10-17,"Fewer Polls This Year, but They Point in Same Direction: A Clear Clinton Lead",New York Times
clinton,2016-10-17,"For Clinton and Trump, There’s Little Debating a Climate Change Divide",New York Times
clinton,2016-10-17,What Are the New Battleground States?,New York Times
clinton,2016-10-17,"Daily Report: Reluctantly, Tech Notices the Election",New York Times
clinton,2016-10-17,Criticism of the News Media Takes On a More Sinister Tone,New York Times
clinton,2016-10-17,Our Feuding Founding Fathers,New York Times
clinton,2016-10-17,"In Donald Trump, Conspiracy Fans Find a Campaign to Believe In",New York Times
clinton,2016-10-17,Sympathetic Canadians Have a Message for Americans: You Guys Are Great,New York Times
clinton,2016-10-18,"Agencies Clashed on Classification of Clinton Email, Inquiry Shows",New York Times
clinton,2016-10-18,No. 39 on Hillary Clinton’s Running Mate List: Bernie Sanders,New York Times
clinton,2016-10-18,"Clinton Challenges Trump for a Traditional Republican Bloc, White Catholics",New York Times
clinton,2016-10-18,Could a President Clinton Be Tough on Wall St.? Her Staff’s Emails Hint Yes,New York Times
clinton,2016-10-18,Hillary Clinton and Donald Trump Answer Your Questions,New York Times
clinton,2016-10-18,"In Hindsight, Backers of Bernie Sanders Lament What Might Have Been",New York Times
clinton,2016-10-18,Donald Trump Says He Might Meet With Putin Before Inauguration,New York Times
clinton,2016-10-18,"Just Because It’s Hacked, Doesn’t Mean It’s Important",New York Times
clinton,2016-10-18,"Ecuador Cuts Internet of Julian Assange, WikiLeaks’ Founder",New York Times
clinton,2016-10-18,"What This 2012 Map Tells Us About America, and the Election",New York Times
clinton,2016-10-29,"Comey, Clinton and This Steaming Mess",New York Times
clinton,2016-10-29,How Hillary Clinton Met Satan,New York Times
clinton,2016-10-29,Clinton Addresses New Email Inquiry,New York Times
clinton,2016-10-29,"A Scandal Too Far? Huma Abedin, Hillary Clinton, and a Test of Loyalty",New York Times
clinton,2016-10-29,Trump on New Clinton Email Inquiry,New York Times
clinton,2016-10-29,"Hillary Clinton Assails James Comey, Calling Email Decision ‘Deeply Troubling’",New York Times
clinton,2016-10-29,WikiLeaks Lays Bare a Clinton Insider’s Emphatic Cheers and Jeers,New York Times
clinton,2016-10-29,"Clintons Did Not Obtain Permits to Renovate Their New Chappaqua Home, Records Show",New York Times
clinton,2016-10-29,"Singing Hillary Clinton’s Praises, in Morgan Freeman’s Voice",New York Times
clinton,2016-10-29,Justice Dept. Strongly Discouraged Comey on Move in Clinton Email Case,New York Times
clinton,2016-10-30,Hillary Clinton Tries to Move Past Email Issue; Donald Trump Revels in It,New York Times
clinton,2016-10-30,Justice Department Obtains Warrant to Review Clinton Aide’s Emails,New York Times
clinton,2016-10-30,"On Clinton Emails, Did the F.B.I. Director Abuse His Power?",New York Times
clinton,2016-10-30,Latest Upshot Poll Shows Trump With a Lead in Florida,New York Times
clinton,2016-10-30,10 Questions (and Answers) About New Email Trove,New York Times
clinton,2016-10-30,Early Turnout Tilts Toward Democrats in Swing States,New York Times
clinton,2016-10-30,"For Democrats, Anthony Weiner Makes an Unwelcome Return",New York Times
clinton,2016-10-30,Witchcraft on the Campaign Trail,New York Times
clinton,2016-10-30,"Clinton, Mosul, Pirate Party: Your Monday Briefing",New York Times
clinton,2016-10-30,Quotation of the Day,New York Times
clinton,2016-10-31,Why Clinton’s Emails Matter,New York Times
clinton,2016-10-31,What Do Clinton and Merkel Have in Common?,New York Times
