Candidate,Date,Headline,Snippet
trump,2016-11-09,Trump and Trudeau Policy Differences,"President Trump and Prime Minister Justin Trudeau of Canada will need to work together despite vast differences on climate change, trade and migrants."
trump,2016-11-09,Mitch McConnell Congratulates Trump,"Senator Mitch McConnell of Kentucky, the majority leader, said working with Donald J. Trump to repeal Obamacare is a “pretty high item on our agenda.”"
trump,2016-11-09,Inside the Trump Victory Party,Stand among Donald J. Trump's supporters at the New York Hilton as the president-elect takes the stage.
trump,2016-11-09,Donald Trump's Victory Speech,Donald J. Trump addressed supporters in New York early Wednesday after he was elected president in a stunning upset against Hillary Clinton.
trump,2016-11-09,Gritting Our Teeth and Giving President Trump a Chance,"We need to be watchdogs, not lap dogs."
trump,2016-11-10,"For Europe, Trump’s Election Is a Terrifying Disaster","From the economy to relations with Russia and everything in between, the new president could spell big trouble for the Continent."
trump,2016-11-10,Are There Limits to Trump’s Power?,"With G.O.P. majorities in Congress, his authority is great."
trump,2016-11-10,Erick Erickson: Eating Crow on Donald Trump,I opposed Donald J. Trump but accept him as my president. That doesn’t mean I’ll accept everything he does.
trump,2016-11-10,Trump Wasn’t in Aetna’s Playbook,"When Aetna ran through postelection expectations, the idea that Donald J. Trump would win was not even in play, said Mark T. Bertolini, the company’s chief executive."
trump,2016-11-10,Ten-Step Program for Adjusting to President-Elect Trump,Here are some practical considerations to help cope.
trump,2016-11-10,President Obama Meets With Trump,President Obama spoke with President-elect Donald J. Trump at the White House on Thursday to discuss the transition of power. President Obama said they had an “excellent” and “wide-ranging” conversation.
trump,2016-11-10,Being American in the Trump Years,"After the graceful concession of Hillary Clinton, we must turn our attention to causes that still need fighting for."
trump,2016-11-10,Trump Expected to Seek Deep Cuts in Business Regulations,"The Trump administration is likely to seek vast cuts in regulations across the banking, health care and energy industries."
trump,2016-11-10,Trump and Obama Hold Cordial 90-Minute Meeting in Oval Office,"President Obama met with President-elect Donald J. Trump, saying about the Trumps: “We want to make sure that they feel welcome.”"
trump,2016-11-10,Daily Report: The Valley Awakens to Trump,"More than most, the tech industry was unready for the election of Donald J. Trump. Now it faces the prospect of feeling like a wary outsider. Is it?"
trump,2016-11-11,‘Never Trump’ Becomes ‘Maybe Trump’ in Foreign Policy Sphere,"Foreign policy luminaries who served in the two Bush administrations largely derided Donald J. Trump, and it was mutual. But some of the establishment figures’ opposition is softening."
trump,2016-11-11,The Market Rises With Trump,“Can you believe that we’re actually sitting here talking about a Trump rally?” asked James Stewart of The New York Times. But traders are in a buying mood – for now.
trump,2016-11-11,Trump’s Economic Prescription. First: Do Harm.,"Plans for tariffs, tax breaks and immigration could push up inflation, shift more money to the wealthy, increase deficits and cost blue-collar jobs."
trump,2016-11-11,"Denounce the Hate, Mr. Trump",The president-elect now has the moral duty to forcefully reject the racism and xenophobia that helped to power his campaign.
trump,2016-11-11,The Women Who Helped Donald Trump to Victory,"The women, mostly white, said it wasn’t so much about voting against Hillary Clinton, but about the change they thought Mr. Trump would enact."
trump,2016-11-11,What Is Donald Trump’s Foreign Policy?,A rundown of the president-elect’s sometimes contradictory pronouncements and what some experts say about the feasibility of his ideas.
trump,2016-11-11,Donald Trump Gets to Work,A wall of a thousand miles begins with one brick.
trump,2016-11-11,Religious Right Believes Donald Trump Will Deliver on His Promises,"Evangelical leaders said they are confident Mr. Trump will appoint a conservative Supreme Court justice, defund Planned Parenthood and stop requiring insurers to cover birth control."
trump,2016-11-11,"In Democratic Stronghold of New York City, Trump Finds Support Among Orthodox Jews","The Orthodox Jewish community of Borough Park, Brooklyn, is where Mr. Trump drew most of his support in the city."
trump,2016-11-11,American Companies Tailor Responses to Trump Election,Some are facing a backlash after remarks that appeared to oppose or support his election.
trump,2016-11-12,Trump and Identity,"Voters discuss what comes next for white, black and brown Americans."
trump,2016-11-12,You Must Serve Trump,"For public servants who fear how Trump might govern, there is a moral responsibility to serve."
trump,2016-11-12,Obama Lobbies Against Obliteration by Trump,How can Barack Obama not understand the Obama revolution?
trump,2016-11-12,Can Trump Save Their Jobs? They’re Counting on It,Employees of a Carrier plant that is scheduled to move to Mexico in 2019 say they expect the president-elect to follow through on his vow to come to their aid.
trump,2016-11-12,Trump’s Hires Will Set Course of His Presidency,Rarely in American history has the exercise of choosing people had such a far-reaching impact on the nature and priorities of a new administration.
trump,2016-11-12,What Europe Needs to Hear from Trump,America’s strongest allies expect a clear commitment to the trans-Atlantic security partnership.
trump,2016-11-12,How Donald Trump Will Divide American and Israeli Jews,The truth is that Israel is going to love President Trump as much as American Jews will hate him.
trump,2016-11-12,The Trump Stock Rally: Calamity Averted With a Little Charm,Markets that had heavily favored Hillary Clinton were poised to dive on election night. Then President-elect Donald J. Trump sweetened his tone.
trump,2016-11-12,Lies in the Guise of News in the Trump Era,Misinformation spread by alt-right websites empowers nuts and undermines democracy.
trump,2016-11-12,International Readers on How a Trump Presidency Could Affect Them,We asked our readers outside the United States to tell us how the election might affect their family and country. We received more than 800 responses.
trump,2016-11-13,Dave Chappelle Hosts ‘S.N.L.’ and Addresses the Protests Against Trump,"Kate McKinnon, as Hillary Clinton, sang the Leonard Cohen song “Hallelujah,” including the lyric, “I told the truth, I didn’t come to fool you.”"
trump,2016-11-13,"Donald Trump Shouldn’t ‘Put His Children Out of Work,’ Giuliani Says",Rudolph W. Giuliani said it would be ‘unrealistic’ for Mr. Trump to remove his children from his business empire. Ethics experts said the remarks were misguided.
trump,2016-11-13,Donald Trump Picks Reince Priebus as Chief of Staff and Stephen Bannon as Strategist,"The appointments created rival centers of power and elevated the voice of Mr. Bannon, whose longtime website, Breitbart News, has traded in conspiracy theories and sometimes racist messages."
trump,2016-11-13,"Obama Heads Overseas, Where Topic of Trump Will Follow Him","On Monday, the president will begin a trip that will take him to Greece, Germany and Peru. At every stop, he is sure to be asked how he got the election so wrong."
trump,2016-11-13,"Donald Trump Appears to Soften Stance on Immigration, but Not on Abortion",The president-elect said his immigration priority was to deport up to three million undocumented immigrants rather than 11 million and that his border wall might be a fence in places.
trump,2016-11-13,European Leaders Gather to Grapple With Donald Trump’s Victory,European Union foreign ministers met on Sunday to discuss potential ramifications of Mr. Trump’s win. Many of his statements have left some European nations vulnerable.
trump,2016-11-13,"Red, Blue and Divided: Six Views of America","Reporters for The New York Times spoke with people across the country to understand the issues that split voters before the election, and today."
trump,2016-11-13,Historians Assess Obama’s Legacy Under Trump’s Shadow,Political scholars offering the “first historical assessment” of the Obama presidency gather to make revisions after the stunning election.
trump,2016-11-13,The Art Market’s Reaction to Trump? Sales This Week Offer First Test,"The sales of Impressionist, Modern and contemporary art that start Monday offer the first test of how the art market will react to a Trump presidency."
trump,2016-11-13,The Incendiary Appeal of Demagoguery in Our Time,"Before Trump’s election in America exposed the failures of democracy, they had been revealed in Modi’s India."
trump,2016-11-14,Trump Slump Coming?,Don’t count on an immediate disaster after the next president takes office.
trump,2016-11-14,Sermons on Trump,"In the days following the election, religious leaders spoke to their congregations and communities about the future with Donald J. Trump as president of the United States."
trump,2016-11-14,How Trump Is Good for China,The Chinese prefer a relationship with a United States that doesn’t impose its values on the world.
trump,2016-11-14,Where Will Trump Stand on Press Freedoms?,It’s one thing to wage a press war as a candidate. It would be another if Trump were to do it from the White House.
trump,2016-11-14,Donald Trump Is Now Hiring,"Mr. Trump, who has no experience in the workings of government, just named his chief of staff and chief strategist. He’s got 4,000 more jobs left to fill."
trump,2016-11-14,Trump’s Rural White America,Shifting demographics contribute to the sharp political divisions seen in this year’s election.
trump,2016-11-14,"Syrian Rebels Brace for a Trump Cutoff, and Look for a Silver Lining","President-elect Donald J. Trump has suggested that he will end support, which some groups hope will encourage Saudi Arabia and Turkey to provide more sophisticated weapons."
trump,2016-11-14,"Greece, Seeking Dose of Stability, Is Rattled by Trump’s Win","A failure to secure debt relief before 2017 could spell a new round of political and economic instability in the country, and Europe as a whole."
trump,2016-11-14,Heng on Trump’s Election and Its Implications for China,The unsettling reality for Beijing is that Donald Trump has a variety of ways to get back at China for trade practices that he views as unfair.
trump,2016-11-14,Trump’s Supreme Court List: Ivy League? Out. The Heartland? In.,The seemingly set-in-stone list has important clues about the president-elect’s judicial priorities. It also contains a few surprises.
trump,2016-11-15,Business or Politics? What Trump Means for Cuba,"Mr. Trump has threatened to roll back President Obama’s sweeping détente, but some analysts say the president-elect’s instincts as a real estate mogul and hotel developer would ultimately prevail."
trump,2016-11-15,"As Donald Trump Builds Team, the Right Scours His Blueprints","The right has been waiting a long time for its chance to upend Washington. Now, its faithful want to be sure the new president does not go soft."
trump,2016-11-15,Firings and Discord Put Trump Transition Team in a State of Disarray,The uncertain start to what is normally a rapid and meticulously planned transfer of power could have big implications for the Trump administration.
trump,2016-11-15,The Trump Effect on Tokyo,The U.S. president-elect’s lack of strategic coherence about East Asia is an opportunity for Japan to help shape America’s policies toward the region.
trump,2016-11-15,Mexico Awaits Trump’s Next Move,"Even without a wall, his border-bashing could backfire on the United States."
trump,2016-11-15,Trump’s Capitol Hill Problem,Don’t fear his legislation — it’s what he can do without Congress that’s terrifying.
trump,2016-11-15,"In China, Toilets Have Trump’s Name Without His Permission","Claims to the name by makers of computers, cosmetics and leather goods highlight the difficulties that big names face when dealing with Chinese trademark laws."
trump,2016-11-15,Ivanka Trump Blurs the Line Between Professional and Political,"Promoting a bracelet from her own brand that she wore during her father’s “60 Minutes” interview, the incoming first daughter raises some eyebrows."
trump,2016-11-15,"Trump Won the Election, but 3 Manhattan Buildings Will Lose His Name","Hundreds of tenants at the buildings on Riverside Boulevard, which contain 1,325 apartments, signed a petition to “Dump the TRUMP name” last month."
trump,2016-11-15,76 Experts Urge Donald Trump to Keep Iran Deal,"A report signed by scholars and former officials asked the president-elect to use the deal, which he has called a disaster, to further ease tensions with Iran."
trump,2016-11-16,Catholic Bishops Challenge Donald Trump on Immigration,"In their annual conference, Catholic bishops elected new leaders and said they are preparing to defend immigrants and refugees against a wave of anger."
trump,2016-11-16,Senate Democrats’ Surprising Strategy: Trying to Align With Trump,"Democrats will try to find common cause with Donald J. Trump on infrastructure spending, child tax credits and dismantling trade agreements."
trump,2016-11-16,"Trump Says Transition’s Going ‘Smoothly,’ Disputing Disarray Reports","The president-elect used Twitter to assure Americans that the handover of power was going well, despite accounts of infighting on his team."
trump,2016-11-16,"As Trump Embraces Term Limits, Allies in Congress Pull Away",The president-elect’s backing of term limits and tougher restrictions on allowing lawmakers to become lobbyists could set up a showdown with congressional Republicans.
trump,2016-11-16,Syrian President Calls Donald Trump a ‘Natural Ally’ in Fight Against Terrorism,Bashar al-Assad also predicted that “opposing forces” in the U.S. government and criticism from the news media could affect Mr. Trump’s actions.
trump,2016-11-16,"Ivanka Trump and Jared Kushner Will Not Seek Security Clearances, Sources Say","The president-elect’s daughter and son-in-law have no plans to apply for top-secret security clearances, according to two people close to the Trump transition."
trump,2016-11-16,Trump’s Transition in a ‘Long History’ of Rocky Presidential Handovers,"Even under typical circumstances, the changeover from one administration to another has been compared to a giant corporate merger involving a $4 trillion budget."
trump,2016-11-16,"With Trump’s Signature, Dozens of Obama’s Rules Could Fall",A little-used law may be used by the Trump administration to strike down regulations passed since this spring under President Obama.
trump,2016-11-16,Megyn Kelly’s Cautionary Tale of Crossing Donald Trump,"While discussing her new book, the Fox News anchor describes her initial run-in with Donald J. Trump as “prescient” and warns fellow journalists to remain vigilant while covering the Trump White House."
trump,2016-11-16,"Under Donald Trump, Harsh Critic of V.A. May Become Its Leader","Mr. Trump, whose team is being advised by advocates of privatized health care for veterans, is considering Representative Jeff Miller to lead the department."
trump,2016-11-17,Trump Team Sets Broader Limits on Lobbying by Former Staff,"The announcement, made in the first transition conference call with reporters, was an attempt to make good on Mr. Trump’s promise to “drain the swamp” in Washington."
trump,2016-11-17,Jeff Sessions Appears Headed to a Trump Cabinet Position,"The president-elect had high praise for the Alabama senator after meeting with him and others at Trump Tower, including Henry A. Kissinger."
trump,2016-11-17,"From Iran to Syria, Trump’s ‘America First’ Approach Faces Its First Tests","As he tries to build a national security team, the president-elect will confront a series of decisions sure to flesh out his approach to world crises."
trump,2016-11-17,"Specter of Race Shadows Jeff Sessions, Potential Trump Nominee for Cabinet","Accusations of racial comments doomed the 1986 court nomination of Mr. Sessions, an Alabama senator under consideration for attorney general or defense secretary."
trump,2016-11-17,"Donald Trump’s Son-in-Law, Jared Kushner, Tests Legal Path to White House Job",Such a move could violate federal anti-nepotism law and risk legal challenges and political backlash.
trump,2016-11-17,Trump Will Have Wide Latitude to Let Family Into Government’s Secret Circles,"After days of reports that Donald J. Trump had requested a top-secret security clearance for his son-in-law, people close to him said that was not the case, but the law would not stop him."
trump,2016-11-17,Yellen on Impact of Trump’s Election,"“We don’t know what’s going to happen,” Janet Yellen, the Federal Reserve chairwoman, told Congress. “There’s a great deal of uncertainty.”"
trump,2016-11-17,The Contradiction at the Heart of Donald Trump’s Economic Policy,"Policies that increase the value of the dollar would make it harder for U.S. manufacturers to compete overseas, one of many trade-offs that a president faces."
trump,2016-11-17,American Institute of Architects Apologizes for Statement of Support for Trump,The industry group backpedals after a backlash from architects and says it will hold events across the country to promote dialogue.
trump,2016-11-17,Trump-Size Idea for a New President: Build Something Inspiring,"The right public works projects can send a message of inclusion and pride. If Donald Trump is ready to take a cue from F.D.R., here are some places to start."
clinton,2016-10-01,"Hillary Clinton’s Positive Message? That Was the Plan, at Least","Over the summer, Mrs. Clinton focused almost exclusively on discrediting Mr. Trump, but now she has tried to offer a more positive campaign message, even as she continues to denounce him."
clinton,2016-10-01,Donald Trump Opens New Line of Attack on Hillary Clinton: Her Marriage,"In an interview, Mr. Trump said he was reconsidering whether he would back Mrs. Clinton if she became president."
clinton,2016-10-01,Hillary Clinton and Democrats Raised $154 Million in September,"Her campaign and the party have a combined cash reserve of $150 million, setting them up for a final spending splurge on television ads and outreach."
clinton,2016-10-01,"After Trump-Clinton, Vice-Presidential Debate Isn’t Exactly ‘the Return of Elvis’","Donald J. Trump and Hillary Clinton drew a record television audience for their first debate. By comparison, their running mates, Mike Pence and Tim Kaine, may be heavier on policy than on pizazz."
clinton,2016-10-01,New Hillary Clinton Ads Look to Expand Lead With Hispanic Voters,"The Clinton team has made Hispanic outreach a cornerstone of its advertising, and results are showing: In Florida, a poll shows her as having a 35-point lead."
clinton,2016-10-01,Report That Donald Trump Did Business in Cuba Ups the Ante in Florida,Revelations that Mr. Trump may have violated the ban on American companies operating in Cuba come as the presidential race is heating up in the state.
clinton,2016-10-01,Trump Infrastructure Plan’s Fatal Flaw,"The Republican nominee has proposed, in effect, to cut spending on infrastructure as part of his plan to borrow for spending on infrastructure."
clinton,2016-10-01,How Could Anyone Vote for Trump?,It’s time for Republican leaders to exercise a little leadership.
clinton,2016-10-01,Girl Talk at Trump Tower,"Stay tuned for “Really Desperate Housewives of Trumpworld,” featuring Newt Gingrich, Chris Christie, Roger Ailes and Rudy Giuliani."
clinton,2016-10-01,¡A votar! Latino Voters Can Make a Difference,A big turnout could thwart Donald Trump’s xenophobic campaign.
clinton,2016-10-02,Donald Trump Criticizes Hillary Clinton,"At a rally on Saturday in Pennsylvania, as his tax records were being released, Mr. Trump mocked Mrs. Clinton’s bout of pneumonia and warned the audience about possible voter fraud."
clinton,2016-10-02,"Rudy Giuliani, Continuing Rebuke of Hillary Clinton, Says ‘Everybody’ Commits Infidelity","Mr. Giuliani’s remarks, on NBC’s “Meet the Press,” were the latest in a string of attacks on the Clintons, and struck many people as hypocritical."
clinton,2016-10-02,‘S.N.L.’ Begins a New Season With Alec Baldwin as Donald Trump,"Kate McKinnon returned as Hillary Clinton in the much-anticipated opening sketch, a parody of the first presidential debate."
clinton,2016-10-02,Donald Trump Suggests Hillary Clinton Isn’t ‘Loyal to Bill’,"Mr. Trump commented on Mrs. Clinton’s marriage during a rally in Pennsylvania, plunging the presidential race further into a personal battle."
clinton,2016-10-02,"Donald Trump, Hillary Clinton, Hoboken: Your Weekend Briefing",Here’s what you need to know about the week’s top stories.
clinton,2016-10-02,Donald Trump and His Allies Struggle to Move Past Tax Revelation,Mr. Trump’s campaign lurched between refusing to acknowledge that released 1995 tax records were bona fide to insisting that his not having paid taxes was evidence of his unrivaled business prowess.
clinton,2016-10-02,"Corrections: October 2, 2016","Corrections appearing in print on Sunday, October 2, 2016."
clinton,2016-10-02,"Sharon Skettini, Leo Clavijo","The couple, who met in 2011 at an after-work party in Montevideo, Uruguay, were wed in Clinton Corners, N.Y."
clinton,2016-10-02,Who Is the Real Elena Ferrante? Italian Journalist Reveals His Answer,An investigative journalist said financial and real estate records indicate that the Italian translator Anita Raja is behind the best-selling author of four novels set in Naples.
clinton,2016-10-02,Alicia Machado vs. Donald Trump’s Machismo,"For the former Miss Universe from beauty pageant-crazy Venezuela, sexism and fat-shaming would be all too familiar."
clinton,2016-10-03,"How Hillary Clinton Grappled With Bill Clinton’s Infidelity, and His Accusers",Bill Clinton’s 1992 presidential campaign used aggressive tactics to combat claims about his extramarital conduct. Here is a look at Mrs. Clinton’s role.
clinton,2016-10-03,Clinton Hits Trump on Taxes,"Hillary Clinton, responding to the New York Times article on Donald J. Trump’s 1995 tax return, told a rally in Toledo, Ohio, that there should be a law requiring major party nominees to release their taxes."
clinton,2016-10-03,"Hillary Clinton, Seizing on Tax Returns, Says Donald Trump Embodies ‘Rigged System’","In Ohio, Mrs. Clinton said revelations that Mr. Trump could have avoided paying income taxes for up to 18 years showed he put “his own interests ahead of the country’s.”"
clinton,2016-10-03,"LeBron James, Calling for Hope and Unity, Endorses Hillary Clinton",The N.B.A. star said on Sunday that Mrs. Clinton would champion children’s causes and “address the violence” in African-American communities.
clinton,2016-10-03,Trump’s Fellow Travelers,Profiles in cowardice and fecklessness.
clinton,2016-10-03,Tim Kaine and Mike Pence Prepare for Vice-Presidential Proxy Fight,"At the debate on Tuesday, the vice-presidential candidates will have to defend their running mates — an especially critical job this time around with such an intense focus on the top of the ticket."
clinton,2016-10-03,The Trump Possibility,It’s the last chance to prevent a lazy and limited man who lies and cheats and thinks he has “great genes” from demeaning the Oval Office.
clinton,2016-10-03,Trump’s Tax (Avoidance) Plan,He is running for president partly to help more wealthy people be like him – and avoid paying taxes.
clinton,2016-10-03,Ailing Obama Health Care Act May Have to Change to Survive,"With plans too expensive and inaccessible for many, the law will almost certainly need to evolve. The election is likely to determine how."
clinton,2016-10-03,"Donald Trump, FARC, Ryder Cup: Your Monday Briefing",Here’s what you need to know to start your day.
clinton,2016-10-04,"Better Polling for Clinton, but Trump Is Keeping Core Support",Donald Trump’s strength among white working-class voters continues to offer him a narrow opening to victory.
clinton,2016-10-04,Clinton Talks to Teen About Body Image,Hillary Clinton responded with fervor to a 15-year-old girl’s question about what she would do to help girls understand “they are so much more than just what they look like.”
clinton,2016-10-04,Hillary Clinton to Girl’s Question on Body Image: ‘Let’s Be Proud of Who We Are.’,"Since last week’s debate, Mrs. Clinton has brought attention to Donald J. Trump’s history of making disparaging remarks about the appearance of women."
clinton,2016-10-04,A Look at Clinton’s Marriage Woes Raises a Question: Really?,"A case can be made, perhaps, for a close look at how Hillary Clinton responded to her husband’s infidelity. But not for this particular story."
clinton,2016-10-04,Assange Says He Has No Intention to Harm Clinton,"The founder of WikiLeaks, Julian Assange, announced via video link that he will soon publish material significant to the United States election and denies that he intends to harm the campaign of Hillary Clinton."
clinton,2016-10-04,Hillary Clinton’s Lonesome White Male Supporters,"They’re awash in Trump fans, who are not shy about their disdain for the Democratic nominee."
clinton,2016-10-04,Vice-Presidential Debate: What You Missed,"Senator Tim Kaine of Virginia and Gov. Mike Pence of Indiana faced off at Longwood University in Farmville, Va., in their only debate."
