Candidate,Date,Headline,Snippet
trump,2016-10-15,Donald Trump’s Barrage of Heated Rhetoric Has Little Precedent,"His near-apocalyptic warnings, accusations and crude innuendo are nearly unheard-of in modern campaigns, unnerving Republicans and enraging Democrats."
trump,2016-10-15,"‘We Should Take a Drug Test’ Before Debate, Donald Trump Says","Mr. Trump, offering no evidence, suggested to a crowd in New Hampshire that Hillary Clinton may have been on drugs during their last debate."
trump,2016-10-15,Michelle Schools Donald Trump,"A quarter century after Anita Hill lost to Clarence Thomas, Michelle Obama takes Trump to task."
trump,2016-10-15,Issues in Hillary Clinton’s Past Leave Her Muted in Furor Over Donald Trump,Mrs. Clinton has been scarred by old missteps and paralyzed by her husband’s history of facing accusations of sexual misconduct.
trump,2016-10-15,"As a Black Republican Senator, Tim Scott Faces a Unique Donald Trump Issue","Instead of defending Mr. Trump, Mr. Scott argues that Hillary Clinton and her fellow Democrats are just as bad on race matters."
trump,2016-10-16,Officials Fight Donald Trump’s Claims of a Rigged Vote,Mr. Trump sowed doubts about the integrity of the democratic process on Sunday even as his own running mate assured voters the election would be legitimate.
trump,2016-10-16,Donald Trump Says He’s a ‘Big Fan’ of Hindus,"He also praised India’s prime minister, Narendra Modi, at an Indian-American charity event."
trump,2016-10-16,Peter Thiel to Donate $1.25 Million in Support of Donald Trump,"The billionaire investor, the only prominent supporter of the Republican candidate in the tech community, joins a very short list of large Trump contributors."
trump,2016-10-16,"Hillary Clinton Builds $150 Million War Chest, Doubling Donald Trump","September was Mr. Trump’s best fund-raising month, but he and committees linked to his campaign began October with only $75 million in cash on hand."
trump,2016-10-16,"Donald Trump and the G.O.P.: The Party of Lincoln, Reagan and, Perhaps, Extinction","Mr. Trump’s rise has exacerbated tensions and deepened divisions within the 162-year-old Republican Party, raising concerns that it may go the way of the Whigs."
trump,2016-10-16,"Specter of Trump Loosens Tongues, if Not Purse Strings, in Silicon Valley","The tech community’s usual reticence about politics is being upended by the prospect of a President Trump, even as traditional fund-raising is lagging."
trump,2016-10-16,Ripples From the ‘How Low Can They Go’ Campaign,"As the run for president veered to Donald J. Trump’s treatment of women, and whether Bill Clinton’s was worse, Americans collectively shook their heads."
trump,2016-10-16,The California Ballot Measure That Inspired a Tax Revolt,"Proposition 13, a populist crusade in 1978 to cut property taxes, set in motion a political process that still reverberates across the nation."
trump,2016-10-16,"Corrections: October 16, 2016","Corrections appearing in print on Sunday, October 16, 2016."
trump,2016-10-16,North Carolina G.O.P. Building Is Firebombed,"Graffiti painted nearby depicted a swastika and the warning, “Nazi Republicans leave town or else.”"
trump,2016-10-17,"Donald Trump, the Worst of America","He is the logical extension of misogyny, racism, privilege and anti-intellectualism."
trump,2016-10-17,Donald Trump’s Playbook for Smearing,"When Trump is feeling cornered, in business or politics, he has a go-to strategy: He lies, and he just keeps lying."
trump,2016-10-17,The New Protesters Defying Donald Trump: His Customers,"Small, inconspicuous acts of rebellion have taken aim at perhaps the candidate’s most prized possession — his brand name — by boycotting what he’s selling."
trump,2016-10-17,"For Donald Trump, Lessons in Grace",The patriotic concession speeches of prior presidential candidates show an alternative to his corrosive conspiracies.
trump,2016-10-17,Audience Members Walk Out on Amy Schumer After Trump Criticisms,"At a show in Tampa, Fla., the comedian’s criticisms of Donald J. Trump drew boos, and some 200 people left."
trump,2016-10-17,Donald Trump Reveals Evangelical Rifts That Could Shape Politics for Years,"While most of the religious right’s old guard has chosen to stand by Mr. Trump, its judgment and authority are being challenged by evangelicals who are younger, minorities and women."
trump,2016-10-17,Why Trump Doubled Down on the Central Park Five,"The Republican nominee still says, despite all the evidence, that the five men confessed to sexual assault so they must be guilty. He’s not alone."
trump,2016-10-17,‘They’re Lies’: Melania Trump Rejects Women’s Claims That Husband Groped Them,"Ms. Trump, who has shied from interviews since her plagiarized speech at the Republican convention, said a lewd recording of her husband was “not the man that I know.”"
trump,2016-10-17,Jared Kushner Talks of a Trump TV Network With a Media Deal Maker,"Mr. Kushner, Donald J. Trump’s son-in-law, informally reached out to a veteran media investment banker, who is also a friend, about setting up the channel."
trump,2016-10-17,I Hardly Expected My Letter to Donald Trump to Go Viral,"Like lots of lawyers, I write dozens of lawyer letters every year — and they tend to have an audience of one."
trump,2016-10-18,Pledging the Trump Fraternity,"Like other groups, Delta Kappa Trump has its own status symbols and initiation ceremonies."
trump,2016-10-18,Obama to Trump: Stop Whining,"Speaking at the White House with the Italian prime minister, President Obama responded to a journalist’s question about Donald J. Trump’s claims of a rigged election by saying Mr. Trump should “stop whining.”"
trump,2016-10-18,Trump Calls for Term Limits,"Donald J. Trump, speaking Tuesday at a campaign event in Colorado Springs, said that if he was elected president he would call for congressional term limits."
trump,2016-10-18,What Our Sons Are Learning From Donald Trump,A presidential candidate’s definition of masculinity prompts a second look at the damaging assumptions behind “boys will be boys.”
trump,2016-10-18,Shameful Silence on Donald Trump’s Lies About Vote-Rigging,Republican leaders must reject the ridiculous notion that a national election can be “rigged.”
trump,2016-10-18,Donald Trump Says He Might Meet With Putin Before Inauguration,"In a radio interview on Monday, Mr. Trump said that Hillary Clinton and the Obama administration have been too aggressive with the Russian president."
trump,2016-10-18,Obama Tells Trump: Stop ‘Whining’ and Trying to Discredit the Election,"At a news conference, the president said Donald J. Trump’s claims showed that the Republican Party’s nominee lacked the leadership or toughness to be president."
trump,2016-10-18,Hillary Clinton and Donald Trump Answer Your Questions,"Readers told us what issues they wanted to hear more about, and the campaigns responded."
trump,2016-10-18,"Trump Wants Big Changes to Legal Immigration, Too — How Big?",Donald J. Trump has proposed the most substantial restrictions on legal immigration in nearly a century.
trump,2016-10-18,Magazine Says Six People Corroborate Writer’s Claim Trump Assaulted Her,"A People magazine article contains comments supporting the accusation of Natasha Stoynoff, a writer for the magazine."
trump,2016-10-19,The Trump Afterlife,Keeping his movement going after November will be a challenge.
trump,2016-10-19,Trump in a Bikini,He relentlessly scrutinizes others. Let’s conduct various examinations of him.
trump,2016-10-19,Melania Trump Mimics Hillary Clinton to Defend Donald Trump,She’s parroting the arguments Clinton used decades ago about a “conspiracy” against Bill.
trump,2016-10-19,The Religious Right’s Trump Schism,“The world is getting a glimpse into the dark and rotting core of evangelicalism.”
trump,2016-10-19,Goldman Sachs C.E.O. on Trump,"“We weren’t meeting in secret and we certainly weren’t plotting the destruction” of America, said Lloyd Blankfein, reacting to comments from Donald Trump."
trump,2016-10-19,Trump and Clinton’s Last Debate: Analysis,Here’s how we analyzed in real time the last presidential debate between Hillary Clinton and Donald J. Trump.
trump,2016-10-19,Review: ‘Michael Moore in TrumpLand’ Isn’t About Donald Trump,"The film, which captures a live stage performance by Mr. Moore, is not a rollicking attack on the Republican nominee but a paean to Hillary Clinton."
trump,2016-10-19,How Donald Trump Hacked the Politics of Foreign Policy,Scholars of American politics say Mr. Trump is using international issues as a medium to connect with voters’ gut-level fears and desires.
trump,2016-10-19,Donald Trump’s Call to Monitor Polls Raises Fears of Intimidation,"The candidate has issued dark warnings about a “stolen” election and voter fraud, using language that is leading to anxiety in minority communities."
trump,2016-10-19,How Silicon Valley Treats a Trump Backer: Peter Thiel,"Peter Thiel, who has drawn fire from fellow tech executives for supporting Donald J. Trump, plans to address the issue in a speech this month."
trump,2016-10-20,Trump and Clinton on Abortion,Donald J. Trump and Hillary Clinton offered drastically different opinions on the issue of abortion during the presidential debate in Las Vegas on Wednesday.
trump,2016-10-20,Was That a Presidential Debate or a Pitch for Trump TV?,"There were two Donald J. Trumps at the debate in Las Vegas: The presidential candidate, and the possible future media mogul."
trump,2016-10-20,Donald Trump’s Contempt for Democracy,"In saying he was not sure if he’d support the election results, Mr. Trump added another reason he is not qualified to be president."
trump,2016-10-20,A ‘Taco Wall’ to Protest Trump,"Supporters of the Democratic nominee for president, Hillary Clinton, surrounded a Trump Hotel in Las Vegas with about 150 taco trucks on Wednesday and staged protests ahead of the final presidential debate."
trump,2016-10-20,Donald Trump vs. American Democracy,He’s desperate for a reason to explain why he’s losing.
trump,2016-10-20,"Donald Trump Is Wrong on Mosul Attack, Military Experts Say","They said that Mr. Trump’s armchair generalship revealed a fundamental lack of understanding of Iraqi politics, military warfare, and military history."
trump,2016-10-20,Donald Trump Won’t Say if He’ll Accept Result of Election,"“I will keep you in suspense,” Donald Trump said at a debate that began cordially but turned caustic. Hillary Clinton replied that his statement was “horrifying.”"
trump,2016-10-20,Trump and the ‘Rigged’ Emmy Awards: A History of Snubs,"“The Apprentice” has been nominated several times for Primetime Emmy Awards, and its losses have apparently weighed on Mr. Trump."
trump,2016-10-20,Donald Trump Says He Will Accept Election Outcome (‘if I Win’),"“Of course I would accept a clear election result, but I would also reserve my right to contest or file a legal challenge in the case of a questionable result,” Mr. Trump said."
trump,2016-10-20,A 10th Woman Accuses Donald Trump of Inappropriate Touching,"Karena Virginia said she was 27 when Mr. Trump approached her, grabbed her arm and touched her breast outside the U.S. Open tennis tournament in 1998."
trump,2016-10-21,"Donald Trump, Enemy of Democracy",What’s the best response from all of us? To fight his attempted despotism with more democracy.
trump,2016-10-21,Trump to Accelerate Campaign Schedule,"Donald J. Trump said in Fletcher, N.C., that from now on he would be packing his schedule with events and expressed determination to win the presidential election."
trump,2016-10-21,Donald Trump’s Theories of Constitutional Interpretation,The Constitution is the guide.
trump,2016-10-21,Trump Speaks at Al Smith Dinner,"After a contentious debate the night before, Donald J. Trump shared the stage with Hillary Clinton one last time."
trump,2016-10-21,Clinton Calls Trump Threat to Democracy,Hillary Clinton’s comments came as Donald J. Trump has repeatedly declined to say that he would accept the results of the presidential election.
trump,2016-10-21,Clinton Jabs Trump at Al Smith Dinner,"Hillary Clinton took the stage at the charity event, a respite of humor in a bruising campaign against Donald J. Trump."
trump,2016-10-21,Trump and Clinton Both Accelerated Spending in September,"Donald Trump spent $70 million, according to reports, more than double the $30 million in August. Hillary Clinton’s campaign spent even more, $95 million."
trump,2016-10-21,Donald Trump’s Defiance Is Seen as ‘Colossal Mistake’ That Threatens U.S. Image,"Diplomats and elected officials fear that Mr. Trump, if he loses, will severely undermine the international reputation of the American political system."
trump,2016-10-21,Trump the Anti-American,"Rage is all that Trump has had to offer. His America is small. But this is still the land of “Sure,” of the embrace of possibility."
trump,2016-10-21,"Trump in April: If I Lose, ‘I’ll Let It All Out’",Making sense of the last days of an improbable campaign.
trump,2016-10-22,Mr. Gingrich’s ‘Big Trump’,Newt Gingrich is positioning himself as the politician best able to mobilize Trump supporters going forward.
trump,2016-10-22,"Thank You, Donald Trump",His boasts have shown what women endure every day.
trump,2016-10-22,What Nixon Could Teach Trump About Losing,"Despite voting irregularities, he refused to cry foul after the 1960 election."
trump,2016-10-22,Gay Republican Group Declines to Endorse Donald Trump,The Log Cabin Republicans said its members were torn between the favorable words Mr. Trump has spoken about their concerns and the anti-gay-rights policies he has embraced.
trump,2016-10-22,Trump Recording Narrows Divide on Sexual Assault,A three-minute clip of Mr. Trump boasting about groping women appears to have prompted a change in consciousness that usually takes decades.
trump,2016-10-22,Donald Trump Pledges to ‘Heal Divisions’ (and Sue His Accusers),"Mr. Trump went to Gettysburg, Pa., for what was supposed to be a major policy speech. He spent much of it dwelling on grievances."
trump,2016-10-22,The Clinton and Trump Foundations Are Vastly Different. Here’s How.,A comparison of the Clinton and Trump Foundations and the controversies that surround them.
trump,2016-10-22,Can Trump Help Us Bridge the ‘God Gulf’?,The crisis among evangelicals over supporting Donald Trump’s candidacy has also provided an opportunity.
trump,2016-10-22,John McCain’s Choice on Trump,"The senator could try to rebuild the Republican Party, or he could play it safe."
trump,2016-10-22,Donald Trump’s Warning on Election Result Sounds Familiar to Some Immigrants,The candidate’s recent comments about the legitimacy of the election have perversely made some immigrants feel right at home.
trump,2016-10-23,Hillary Clinton Presses Her Advantage Over a Struggling Donald Trump,"With a strong lead in national polls, Mrs. Clinton is urging core Democratic constituencies to vote early in states where balloting has begun."
trump,2016-10-23,Donald Trump’s Threat to Reject Election Results Alarms Scholars,"Mr. Trump’s claims that the vote will be “rigged” and “taken away from us” erodes popular faith in democracy, political scientists say."
trump,2016-10-23,G.O.P. Hopefuls in New York Races Walk Tightrope on Donald Trump,Republicans are trying to find a balance between expressing support for Mr. Trump and distancing themselves from a candidate who may become toxic to the moderates and independents they need to win.
trump,2016-10-23,Donald Trump Gets First Major Endorsement in Las Vegas,"The Las Vegas Review-Journal, Nevada’s largest newspaper, is the first major newspaper to give Mr. Trump its support."
trump,2016-10-23,‘Not a Regular Day’: What a Trump Rally Clash Reveals About a Divided Nation,"In June in San Jose, Calif., a tug of war over a sign supporting Donald J. Trump sent one man to jail for six days and another man to soul-searching. This is their story."
trump,2016-10-23,"With Tom Hanks Aboard, ‘S.N.L.’ Parodies Final Presidential Debate","In the show’s opening sketch, Alec Baldwin and Kate McKinnon reprised their roles as Donald Trump and Hillary Clinton, with Mr. Hanks playing the moderator Chris Wallace."
trump,2016-10-23,"Now at GQ, Keith Olbermann Takes His Outrage Online","Mr. Olbermann, the itinerant sports and news broadcaster, is making a series of commentaries opposing Donald J. Trump."
trump,2016-10-23,"Obama Assists 150 State Candidates, Targeting G.O.P.’s Grip on Legislatures","Republicans control most statehouse chambers, but with Donald J. Trump stumbling, Democrats hope for down-ballot gains in Minnesota, Colorado, Nevada and elsewhere."
trump,2016-10-23,On the Trail: Week of Oct. 16,"Hillary Clinton stayed off the campaign trail for most of the week, meeting Donald J. Trump for the final presidential debate on Wednesday, and again on Thursday, at the Al Smith dinner."
trump,2016-10-23,"AT&T, Chicago Cubs and Mosul: Your Weekend Briefing",Here’s what you need to know about the week’s top stories.
trump,2016-10-24,It’s Trump’s Party,Don’t let anyone pretend otherwise.
trump,2016-10-24,"What’s in a Name? When It’s ‘Trump Place,’ It’s a Revolt","At three large rental buildings on the Upper West Side of Manhattan, a movement is underway to rid the properties of Donald J. Trump’s name."
trump,2016-10-24,Sorting Out a ‘Big’ Trump Controversy,"Donald J. Trump’s use of the phrase “big league” has divided social media into two camps: Those who believe he said “bigly,” and those who heard “big league.”"
trump,2016-10-24,"Yes, Trump Really Is Saying ‘Big League,’ Not ‘Bigly,’ Linguists Say","An unusual turn of phrase, combined with Donald Trump’s unique pronunciation of it, has confused, and amused, listeners."
trump,2016-10-24,"For Republicans Abandoning Donald Trump, Obama Has a Message: ‘Too Late’","The president, widening his attack on Mr. Trump, excoriated Representative Joe Heck of Nevada and others for failing to reject the candidate earlier."
trump,2016-10-24,Clinton Leads Trump as Marathon Nears the Final Sprint,"The Trump camp conceded that it was lagging, but the campaign manager, Kellyanne Conway, said it still saw a path to victory."
trump,2016-10-24,"Donald Trump Dismisses Latest Accuser: ‘Oh, I’m Sure She’s Never Been Grabbed Before’","Mr. Trump disparaged an actress named Jessica Drake, who over the weekend said that in 2006 he had groped and kissed her without her permission."
trump,2016-10-24,"Fearing Trump, Bar Association Stifles Report Calling Him a ‘Libel Bully’",Critics of the American Bar Association said the decision was ironic since the group is supposed to explore issues about threats to free speech.
trump,2016-10-24,Could Hillary Clinton Win Texas? Some Democrats Say Maybe,"The state has voted for the G.O.P. candidate in the past nine presidential elections, but Donald J. Trump may have created an opening for Mrs. Clinton."
trump,2016-10-24,WikiLeaks’ Gift to American Democracy,Revelations about Donald Trump and the Clinton campaign have pulled back the curtain on the political-celebrity mythmaking the media too often abets.
trump,2016-10-25,"A New Trump Brand Not Named for Trump? Yes, Meet Scion",A hotelier’s attempts to branch out are complicated by a presidential campaign.
trump,2016-10-25,Trump Rails Against Obamacare,Donald J. Trump said that figures suggesting Affordable Care Act premiums would increase by an average of 25 percent for next year were far too low.
trump,2016-10-25,Is This Election Rigged Against Trump?,"With Donald J. Trump's claims that the election is rigged against him, we take a look at past close and contentious elections."
trump,2016-10-25,Omarosa Manigault Changed Parties for Trump,The campaign official believes the Republican nominee can secure 15 percent of the African-American vote.
trump,2016-10-25,"What Drives Donald Trump? Fear of Losing Status, Tapes Show","In more than five hours of conversations — the last extensive biographical interviews he granted before running for president — Mr. Trump makes clear how difficult it is for him to imagine, let alone accept, defeat."
trump,2016-10-25,Obama Urges Democrats to Turn Out in Force Against Donald Trump and G.O.P.,"Mr. Obama said the coming election was a test of American values, with grave stakes for the country and for the next president’s ability to govern in a divisive time."
trump,2016-10-25,Consultant With Ties to Donald Trump Linked to Offer to Hide Source of Donations,A video by a British newspaper appears to show a former consultant to a pro-Trump super PAC offering to disguise the source of foreign contributions.
trump,2016-10-25,From ‘Hamilton’ to Donald Trump: Are All ‘Grievances’ Created Equal?,Airing and addressing them is a founding principle of American democracy. But what if a claim of injustice is just a grudge?
trump,2016-10-25,"Seizing on Rising Costs, Trump Says Health Law Is ‘Over’","The Trump campaign, desperate for a winning political issue in the final two weeks of the race, mounted an offensive against the Affordable Care Act."
trump,2016-10-25,‘I Had a Scary Dream About Donald Trump’: Muslim Parents Face a Tense Election,"Across the country, Muslims have been addressing with their children a news cycle that includes Mr. Trump’s calls to kick Muslims out of the United States and the recent bombing in Manhattan."
trump,2016-10-26,Donald Trump the Candidate Promotes Trump the Brand on Campaign Trail,"As his poll numbers have fallen, Mr. Trump has taken reporters to his top properties in between campaign events — perhaps looking beyond Election Day."
trump,2016-10-26,How Donald Trump Used Hollywood to Create ‘Donald Trump’,"Donald J. Trump has been a near-constant presence in TV shows, movies, documentaries, pageants and even professional wrestling events, since the 1980s."
trump,2016-10-26,"Donald Trump, Alien to All That’s Great","We know who he is. The big question now is, who are the rest of us?"
trump,2016-10-26,Trump Unveils Hotel in Washington,Donald J. Trump turned his attention away from the presidential race long enough for a ribbon-cutting at his new hotel in Washington.
trump,2016-10-26,"A Close Race for Darrell Issa, the House’s Mini-Trump","Representative Issa, the car-alarm king of California, finds his embrace of Mr. Trump could cost him — so now he’s embracing Mr. Obama."
trump,2016-10-26,Black Voters on Donald Trump: We’ve Heard It All Before,"For many black Americans, Mr. Trump is a familiar figure whose candidacy is exposing to others the diminishing words they have heard their whole lives."
trump,2016-10-26,Trump TV Offers (Fledgling) Framework for Potential Media Future,An election show streaming on Facebook Live is fueling speculation that Donald J. Trump is laying the groundwork for a media empire to come.
trump,2016-10-26,Donald Trump’s Star on Hollywood Walk of Fame Is Smashed,A man was arrested and accused of taking a sledgehammer and a pickax to Donald J. Trump’s star on Hollywood Boulevard in Los Angeles.
trump,2016-10-26,Donald Trump Allies Focus Anger on Another Target: G.O.P. Leaders,Conservatives in the factionalized Republican Party are already fanning the flames for a postelection revolt against Speaker Paul D. Ryan.
trump,2016-10-26,"Women, the Military and Bill Clinton: Donald Trump on Tape","In interviews from 2014 with his biographer, Mr. Trump is candid about everything, from his marriages to Mr. Clinton’s golf game."
trump,2016-10-27,How Do You Explain Trump in Russia?,Teaching English is easy compared with answering questions about the G.O.P. presidential nominee.
trump,2016-10-27,Emails With My Favorite Trump Supporter,I tell my old friend that he’s revolting and dangerous and to tell his wife that I say hi.
trump,2016-10-27,Donald Trump’s Lack of Discipline and Discernment,"According to his own words, he objectifies women, prioritizes fighting and fetishizes adoration."
trump,2016-10-27,Some Donald Trump Voters Warn of Revolution if Hillary Clinton Wins,"Among Mr. Trump’s supporters, some worry that they will be forgotten, along with their concerns, if Mrs. Clinton wins. Others predict violent conflict."
trump,2016-10-27,"Abandoning Donald Trump and, for Some Women, the G.O.P., Too","The Republican Party is in the midst of a gender war, with men and women taking sharply different stances over accusations of groping by Mr. Trump."
trump,2016-10-27,"A Close Race for Darrell Issa, the House Mini-Trump","Representative Darrell Issa, elected to the House in 2000, is one of two California Republicans whose re-election bids are imperiled by their embrace of Mr. Trump."
trump,2016-10-27,Review: Another Look at Donald Trump’s Scottish Dealings,"“You’ve Been Trumped Too,” from Anthony Baxter, follows up on what happened to residents of Balmedie after Mr. Trump built a golf resort there."
trump,2016-10-27,Donald Trump Offers His Version of ‘New Deal for Black America’,"The plan combines elements of his education proposals, tax cuts and immigration policies to revive cities that he has described as blighted."
trump,2016-10-27,The Dark Days of Donald Trump,The half-minute candidate takes care of business.
trump,2016-10-27,"With a Politician’s Flair, Khizr Khan Tries to Push Clinton to Finish Line","At a seafood restaurant in Virginia, Mr. Khan made his first appearance on the campaign trail for Hillary Clinton but said his mission transcended politics."
trump,2016-10-28,Donald Trump in Bollywood,It’s not surprising that he would go after Indian voters.
